Marchio;Nome;Prezzo;Valutazione;Colore
Clarks;Sillian 2.0 Rise, Stivaletto Donna;191,13;4;Nero
Clarks;C Mocc;191,13;4;Nero
Clarks;Un Cosmo Zip, Scarpe décolleté Donna;184,06;3;Nero
Clarks;Ashland Spin Q - Slip da Donna, Nero, 42 EU;212,87;4,3;Nero
Clarks;Donna Ashland Lane Q Slip-On Loafer, Nero, 38 EU;200,64;4,4;Nero
Clarks;Channing Ann, Mocassino da infilare Donna, Pelle Nera, 41 EU;443,82;4,2;Nero
Clarks;Ashland Spin Q Mocassino Donna;309,08;4,4;Nero
Clarks;Ashland Qashland Spin Q - Pantofole da Donna, Nero, 40 EU Stretta;183,28;4,5;Nero
Clarks;Pantofole in Maglia, Donna, Nero, 36.5 EU;188,73;4,6;Nero
Clarks;Arla Shore, Sandali Bassi Donna;207,81;4,4;Nero
Clarks;Movie Retro, Stivali con Gambale Corto Donna;192,78;4,3;Nero
Clarks;Torhill Hi - stivali da donna - taglia 39.5 (EU) 6 (UK);181,76;3,9;Nero
Clarks;Scena Stella, Stivali a metà Polpaccio Donna;221,67;4,2;Nero
Timberland;Timberland;195,27;4,5;Nero
Clarks;Mocassino da Donna Sarafyna Sky Dress;138,8;3,9;Nero
Clarks;Sarafyna Sky Mocassino Donna Pelle Nero 9 W, Pelle nera, 39 EU;155,33;4,4;Nero
Clarks;donna Amanda Sprint Sandalo piatto;214,26;4;Nero
Clarks;Scarpe basse da donna Fiana Ease Mary Jane;204,97;4;Nero
Clarks;donna Drift Fern Flat Sandalo;190,64;2,4;Nero
Clarks;Stivale Oxford Calla Charm Donna;184,06;3,8;Nero
Clarks;Stivaletti Jaunt Lo da donna, Pelle nera, 7 US;230,99;4,2;Nero
Clarks;Jillian Luminoso, Sandali con Zeppa Donna;179,59;4,2;Nero
Timberland;Mont Chevalier Chelsea Stivali da donna alla caviglia TB 0A2JGQ Nero;212,88;1;Nero
Clarks;Pantofole da donna in feltro di lana, JMH1319T, calde e accoglienti, foderate in finta pelliccia, per interni ed esterni;59,55;4;Nero
Clarks;Clarks, Rena Jazz Ballerine Donna Donna, Leat Nera, 8.5;183,28;4,2;Nero
Clarks;Rena Step Ballerine Donna;203,8;3,6;Nero
Clarks;Magnolia - Mocassino da donna con zip;213,66;4,3;Nero
Clarks;Sneakers da donna in pelle scamosciata antiscivolo casual e alla moda;276,29;5;Nero
Clarks;Sandali da donna April Dusk Slide, Interesse nero, 42 EU;177,16;4,2;Nero
Clarks;Donna Freva 55 Strap Pump;296,72;4,2;Nero
Clarks;Women's Lizby Ease Slide Sandal;205,87;4,2;Nero
Clarks;Desert Aerial Donna, Nero (Black Interest Suede), 41 EU;280,11;5;Nero
Clarks;Collection Fiana Bay - Stivaletti da donna, Nabuk nero, 37.5 EU;208,6;4,3;Nero
Clarks;Maye Aster, Stivali alla Moda Uomo;215,45;4;Nero
Clarks;Kyndall Faye, Stivali alla Moda Donna;185,64;5;Nero
Clarks;Stivali da donna Maye Palm Fashion;181,47;4,2;Nero
Clarks;Juliet Shine Mocassini Donna, Pelle nera, 7 Wide;182,31;4,4;Nero
Clarks;Stivaletto donna Ambyr Hope, Pelle scamosciata nera, 9.5;184,69;3,5;Nero
Clarks;Talene Ave Mocassini Donna;182,31;4;Nero
Clarks;Hearth Rose - Stivali da donna a metà polpaccio;199,53;4,5;Nero
Clarks;Kayleigh Charm, Mocassino Donna;182,56;4,3;Nero
Clarks;Mocassini da donna Juliet Trim, Pelle nera, 40 EU;;4,5;Nero
Clarks;Sandalo Slide Donna;216,03;4,2;Nero
Clarks;Laurieann Kay, Sandali Bassi Donna;196,25;4,2;Nero
Clarks;Merliah Karli, Sandali a Ciabatta Donna;303,98;4,4;Nero
Clarks;Laurieann Gema, Sandali Donna;230,96;4,2;Nero
Clarks;Adella Holly, Scarpe da Ginnastica Donna;205,32;4,4;Nero
Clarks;Mira Marea, Sandali Bassi Donna;117;4,5;Nero
Clarks;Sandalo da donna Leisa Cacti Slide Clarks, in pelle nera, 5,5 M US;111,5;4,5;Nero
Clarks;Maggio Calendula, Mocassino Slip-On Donna;181,47;3,5;Nero
Clarks;non strutturati Un.loop Slip-on del pattino;197,42;3,8;Nero
Clarks;Pantofole da donna in pelle scamosciata con colletto lavorato a maglia e fodera in pelliccia sintetica, pantofole per interni ed esterni, pantofole da donna con intersuola in sughero;200,02;4,6;Nero
Clarks;Stivaletti da donna stile Carleigh;184,67;4,4;Nero
Clarks;Breeze Piper, Sandali a Ciabatta Donna, 10,11,12,5,6,7,8,9 M Womens Adult;186,54;4,1;Nero
Clarks;Stivale Christine Club Donna;57,61;4,5;Nero
Clarks;Pawley Adwin, Scarpe da Ginnastica Donna;195,3;4,3;Nero
Clarks;Passo eroe;203,58;4;Nero
Clarks;Lafley Giglio, Sandali con Zeppa Donna;117;3,8;Nero
Clarks;Oricon 2 Mid Black Nero, 39;185,64;4;Nero
Clarks;SHEER25 Strap Nero;290,4;4,4;Nero
Clarks;Stile Trish, Mocassini Donna, US Women;200,09;4;Nero
Clarks;Brio Sol, Infradito Donna;;5;Nero
Clarks;Juliet Lora, Mocassino Donna;;4,3;Nero
Clarks;Ashland Qashland Spin Q - Pantofole da Donna, Nero, 41 EU Larga;;4;Nero
Timberland;Roxie Lane Mid Lace Boot TB0A295JW02, Stivali;196,39;4,8;Nero
Clarks;Aspra - Stivaletti da donna con fibbia;195,29;3,9;Nero
Clarks;Sandali bassi da donna Arwell Walk, Pelle nera, 37.5 EU;212,36;3,4;Nero
Clarks;Sandali da donna Siara 65 Flow con tacco;229,38;4,4;Nero
Clarks;Ballerine da donna Fawna Lily;209,49;4,5;Nero
Clarks;Sandalo da donna con zeppa Manon Wish;250,79;3,6;Nero
Clarks;Sandali bassi da donna Arwell Walk;213,95;3,1;Nero
Clarks;Sandali da donna Tuleah May con tacco;199,4;1;Nero
Clarks;Sandali da donna Tuleah Sun con zeppa, Pelle nera, 37.5 EU;195,27;3,9;Nero
Clarks;Sandali bassi da donna Arwell Sling;85,81;5;Nero
Clarks;Colomba Giselle, Sandali con Zeppa Donna, Nabuk Nero, 42 EU Larga;85,81;4;Nero
Clarks;Décolleté Suttyn May Donna, Pelle nera, 40 EU;85,81;4,2;Nero
Clarks;Mocassini da donna Zylah May;252,31;3,8;Nero
Clarks;Clarks Décolleté Suttyn May Donna, Pelle nera, 40 EU Larga;280,22;4,2;Nero
Clarks;Premium Hollyhock Zip, Donna, Nabuk Nero, 39 EU;195,27;4,5;Nero
Clarks;Rosalyn Belle, Écharpe habillée Donna;201,59;3,6;Nero
Clarks;Premium Hollyhock Zip, Donna, Pelle Nabuk Nera, 39 EU;198,43;3,9;Nero
Clarks;Hollyhock Zip, Donna;204,37;4,5;Nero
Clarks;Sandali da donna Kitly Walk Slide;184,28;5;Nero
Clarks;Ballerine Natalyn Wish Donna, Pelle nera, 37 EU;204,34;5;Nero
Clarks;Craft - Coppa in pizzo;202,64;5;Nero
Clarks;Wallabee Cup Black Nubuck 6.5 B (M);202,54;5;Nero
Clarks;donna Sheer 55 Sling;318,4;5;Nero
Clarks;Facilità alla Deriva, Sandali con Zeppa Donna;255,58;4,1;Nero
Clarks;Donna Emily 2 Ruby Pump, Pelle nera, 6.5;197,2;4;Nero
Lumberjack;SW25506 003 P05 Sandalo Zeppa Donna Nero 37;194,35;4,5;Nero
Clarks;Caroline bay, Ciabatte Donna;264,27;4,1;Nero
Clarks;Sneaker Caroline Janna Donna, Pelle nera, 37.5 EU;199,77;3,7;Nero
Clarks;Sandalo da donna con zeppa Giselle Ivy, Nabuk nero, 40.5 EU;181,78;4,8;Nero
Clarks;Parco Ambyrlyn, Sandali a Ciabatta Donna, Nabuk Nero, 39 EU Larga;246,72;3,2;Nero
Clarks;Parco Ambyrlyn, Sandali a Ciabatta Donna, Nabuk Nero, 40 EU;184,06;4,6;Nero
Clarks;Parco Ambyrlyn, Sandali a Ciabatta Donna, Nabuk Nero, 40 EU;286,79;1;Nero
Clarks;Sandalo Elleri Prugna Donna;183,01;3,1;Nero
Clarks;Sandali Brynn Step da donna Pelle EU;183,01;3,8;Nero
Clarks;Donna Sarafyna Iris, Pelle nera, 37 EU;215,57;5;Nero
Clarks;Mocassino da donna Sarafyna Iris, Pelle nera, 37.5 EU;202,61;4,7;Nero
Clarks;Donna Sarafyna Iris, Pelle nera, 39 EU;182,05;1;Nero
Clarks;Magnolia Faye;200,84;5;Nero
Clarks;Mocassino da donna Magnolia Faye Slip On;199,83;4,2;Nero
Clarks;Sandalo Donna Rose Ease Zeppa, Pelle nera, 41 EU;232,37;4,8;Nero
Clarks;Sandalo Donna Rose Ease Zeppa, Pelle nera, 42 EU;197,76;4,8;Nero
Clarks;Merliah Derby, Sandali con Tacco Donna;266,6;4,3;Nero
Clarks;Aprile Cove, Sandali Bassi Donna;218,63;3,8;Nero
Clarks;Cerniera Maye, Stivali a metà Polpaccio Donna;203,47;5;Nero
Clarks;Escursione alla Deriva, Sandali con Zeppa Donna;243,27;3,6;Nero
Clarks;Sneaker Donna Tivoli Grace;200,63;5;Nero
Clarks;Ambyr 2 Braley da donna, Pelle nera, 42 EU;187,36;5;Nero
Clarks;Ambyr2 Braley - Décolleté da donna, Pelle nera, 38.5 EU;181,34;4,2;Nero
Clarks;Ambyr 2 Braley da donna, Pelle nera, 37 EU;181,56;4,5;Nero
Clarks;Rena Way - Ballerine da donna, nero, 43 EU;124,37;3,9;Nero
Clarks;Cinturino da donna Jemsa;232,95;4;Nero
Clarks;Via Kitly;199,71;4,4;Nero
Clarks;Fiore alla deriva, Sandali Bassi Donna;176,99;4,3;Nero
Clarks;Nalle Violet, Mocassino Donna;225,36;3;Nero
Clarks;Sneaker Breeze Ave Ii da donna, Tessuto nero/bianco, 39.5 EU;171,55;4,1;Nero
Clarks;Emily Holly, Stivaletto Donna;198,61;4,4;Nero
Clarks;Pelliccia di, Stivaletto Donna, 10,11,5,5.5,6,6.5,7,7.5,8,8.5,9,9.5 M Womens Adult;195,29;4,4;Nero
Clarks;Stivaletto da donna Magnolia Haley;205,47;4,2;Nero
Clarks;Cielo Airabell, Camoscio nero, 39 EU;195,27;4,4;Nero
Clarks;Sandalo piatto Laurieann Nora da Donna;241,82;4,7;Nero
Clarks;Sandalo Donna Rose Erin Zeppa;190,02;4,8;Nero
Clarks;Glide Post, Infradito Donna, 10,11,12,5,6,7,8,9 M Womens Adult;203,26;1;Nero
Clarks;Sandalo piatto Laurieann Ayla da donna, Pelle nera, 40 EU;181,76;3,7;Nero
Clarks;Sandalo piatto Laurieann Ayla da donna, Pelle nera, 40.5 EU;350,96;3,6;Nero
Clarks;Sandalo Laurieann Cove Donna;204,07;4;Nero
Clarks;Mocassino Cora Ashly da donna, Pelle nera, 36.5 EU;333,18;3,7;Nero
Clarks;Stivale da donna Scene Star Mid polpaccio, Pelle nera, 38 EU;263,96;4,5;Nero
Clarks;Maye Zip, Stivali a metà Polpaccio Donna, Effetto Pelle Scamosciata Nera, 36.5 EU Larga;41,59;4,6;Nero
Clarks;Stivale Orinoco2 Mid Donna;249,05;3,6;Nero
Clarks;Focolare Faye, Stivaletto Donna;229,27;4;Nero
Clarks;Wallabee Boot, Stivaletto Donna;134,68;4,4;Nero
Clarks;Sandalo con zeppa Clara Rae Uomo;41,59;3,5;Nero
Timberland;Playa Sands Sports Slide Ciabatte/Zoccoli Uomini Nero Ciabatte Shoes;213,07;5;Nero
Clarks;Women's Ingalls Falls Black Boot 7.5 B (M);212;5;Nero
Lumberjack;SW25506 003 P05 Sandalo Zeppa Donna Nero 37;50,05;4,5;Nero
Clarks;Aubria Muse Mary Jane Flat donna, nero, 6,5 milioni di euro;249,63;4,5;Nero
Geox;Slip-on Nero D6434D 02285;204,64;4,6;Nero
Geox;Sneakers Nero D6434B 02285;204,97;3,5;Nero
Geox;D640SE 000EM Stivaletto Donna nd 35;180,4;4,3;Nero
Clarks;Artisan Corsio Bambi Donna US 8 Nero Sandalo Gladiatore;197,14;4;Nero
Clarks;Sandalo da donna Leisa Cacti Slide, in pelle nera, 8,5 N US;199,53;3;Nero
Clarks;Sandalo da donna Leisa Cacti Slide Clarks, in pelle nera, 9 N US;225,66;4,4;Nero
Clarks;Medora Jem, Mocassino Donna;315,21;4,4;Nero
Clarks;Ashland Spin Q, Mocassino Donna, Nero, 38.5 EU;267,98;3,4;Nero
Clarks;Ashland Lane Q, Mocassino Unisex-Adulto;56,12;4,2;Nero
Clarks;Vallee Pine Flat;47,75;4,2;Nero
Clarks;Sandalo da donna Leisa Cacti Slide Clarks, in pelle nera, 5,5 M US;191,13;3,9;Nero
Clarks;Sandalo da donna Leisa Cacti Slide Clarks, in pelle nera, 6 W US;183,03;4,4;Nero
Clarks;Plaza Pug Stivali da Equitazione;362,33;1;Nero
Clarks;Maggio Calendula, Mocassino Slip-On Donna;195,8;4,2;Nero
Clarks;non strutturati Un.loop Slip-on del pattino;226,41;4,2;Nero
Clarks;non strutturati Un.loop Slip-on del pattino;236,16;1;Nero
Clarks;non strutturati Un.loop Slip-on del pattino;248,25;4,2;Nero
Clarks;KIMMEIHI Strap Arancio;204,17;4;Nero
Clarks;Layton Lace, Sneaker Donna;191,13;4,5;Nero
Clarks;Wallacraft Lo Nabuk Nero;197,42;4;Nero
Clarks;Wallacraft Lo Nero Nubuck;180,43;4,4;Nero
Clarks;Un Capri Step Sandali con zeppa Donna;200,02;4,2;Nero
Clarks;C Mocc;184,7;4,2;Nero
Clarks;Un Moon - stivali da donna - taglia 40.5 (EU) 7 (UK);156,95;4,1;Nero
Clarks;Un Moon - stivali da donna - taglia 36 (EU) 3.5 (UK);156,95;4,5;Nero
Clarks;Décolleté Emily Belle da donna;181,47;3,9;Nero
Clarks;Brinkley Flora, Infradito da donna, 40.5 EU;198,85;4,2;Nero
Clarks;Calla Mid, Stivali alla Moda Donna;189,94;4,5;Nero
Clarks;Breeze Glide, Stivaletto Donna;183,01;3,6;Nero
Clarks;Wave 2.0 Lace. Scarpe in Nabuk;205,65;3,1;Nero
Clarks;Women's Appley Zip Loafer, Black Leather, 8.5;199,97;4,6;Nero
Clarks;Eliza Aprile, Sandali a Ciabatta Donna, US;199,23;4,4;Nero
Clarks;Sandalo da donna con tacco a mulo, 65;197,6;3,8;Nero
Clarks;Laurieann Kay, Sandali Bassi Donna;197,17;4,6;Nero
Clarks;Adreena Hi, Stivali Chelsea Donna;189;3,8;Nero
Clarks;Tilmont Slip, Ballerine Donna;217,86;4,6;Nero
Clarks;Laurieann Judi, Sandali Bassi Donna;185,64;2,5;Nero
Clarks;Jillian Bright, Sandali Donna;245,48;4,2;Nero
Geox;Stivali Nero D36VQC 00043;200,57;2,6;Nero
Clarks;Laurieann Erin, Sandali Bassi Donna;201,28;5;Nero
Clarks;Aspra Walk - Stivaletti impermeabili da donna;169,72;4,4;Nero
Clarks;Mocassino da donna Carleigh Pearl, Pelle nera, 7.5 Narrow;195,53;4,2;Nero
Clarks;Hearth Cross - Stivali da donna a metà polpaccio;206,69;4,5;Nero
Clarks;Stivali Bayla Light Fashion da donna, Pelle nera, 37.5 EU;261,45;3,5;Nero
Clarks;donna Bayla Light Fashion Boot, Pelle nera, 7;236,41;4,1;Nero
Clarks;Holly, Pantofole Donna;185,67;4,3;Nero
Clarks;Giglio Desirae, Sandali con Tacco Donna;195,35;3,9;Nero
Clarks;Stivaletti Donna Orinoco 2 Spice;220,92;3,9;Nero
Clarks;Cora Pace, Stivaletto Donna, Pelle Nera, 41 EU;237,04;4,7;Nero
Clarks;Loken Zip impermeabile moda stivali donna;197,14;2,5;Nero
Clarks;Pompa Rosalyn Belle Dress;83,89;5;Nero
Clarks;Donna Rosalyn Belle, Pelle Nera., 39/40 EU;110;3,8;Nero
Clarks;Artigianale Sage Glamour;214,66;4,2;Nero
Timberland;Timberland;246,98;3;Nero
Clarks;Wms Trapuntato Chiusa Schiena Piatta;195,27;4,5;Nero
Clarks;Merrian Lynn Boot;193,51;4,1;Nero
Clarks;Wallabee Cup Hi Camoscio Nero;232,57;4,1;Nero
Clarks;Stivaletto da donna Magnolia Charm;250,54;5;Nero
Clarks;Women's Tamzen Zip Loafer, Black Nubuck, Size 5;157,91;4,8;Nero
Clarks;Orianna Hiker Pelle Marrone Scuro;287,41;4,3;Nero
Clarks;Pantofole da donna in maglia con colletto in pelle scamosciata, in pelliccia sintetica per interni ed esterni in TPR suole e plantare imbottito, nero, 39 EU;176,63;4,6;Nero
Clarks;Pantofole da donna in maglia con colletto in pelle scamosciata, in pelliccia sintetica per interni ed esterni in TPR suole e plantare imbottito, nero, 43 EU;176,63;3,7;Nero
Clarks;Demi Beat, Stivali da Motociclista Donna;195,27;5;Nero
Clarks;Narrativa Mezze Rose, nero, 36 EU;237,42;4,2;Nero
Clarks;Sara Clover, Ballerine Donna;198,92;4,9;Nero
Clarks;Women's Laina 55 Boot 2 Ankle Boot, Leopard Print Suede;218,23;4,3;Nero
Clarks;Carly Desidero, Ballerine Donna;235,7;4,2;Nero
Clarks;Orinoco 2 Pizzo;270,46;4;Nero
Clarks;Cora Tropic - Stivale da donna;240,92;3,8;Nero
Clarks;Step Rose Moon, Piattaforma Donna, / US Frauen;236,64;4;Nero
Clarks;Un Adorn Lane Sandalo da donna;253,07;3,3;Nero
Timberland;Mont Chevalier, Stivali da Motociclista Donna;157,32;4,1;Nero
Clarks;Womens Arla Glison Black Thong Sandal - 9;218,97;4,7;Nero
Clarks;Hazen Penny Slide Mocassino Donna;260,77;2,3;Nero
Clarks;Avington Hayes Donna, Nero (Black Combination Cow Suede), 36.5 EU;240,94;2;Nero
Clarks;Da donna Daelyn City Slip-On;201,46;4,2;Nero
Clarks;Sneakers da donna Un Rio Spark Slip On;237,85;4,2;Nero
Clarks;Women's Merliah Karli Sandal, Black Leather, 10 Wide;197,75;4,5;Nero
Clarks;Women's Merliah Karli Sandal, Black Leather, 8 Wide;199,66;4,2;Nero
Clarks;Women's Merliah Karli Sandal, Black Leather, 9 Wide;182,31;4,3;Nero
Clarks;Women's Merliah Karli Sandal, Black Leather, 6.5;215,56;3,8;Nero
Clarks;Leisa Faye, Sandali Bassi Donna;195,8;4,3;Nero
Clarks;Stivale Desert Donna, Scarpe Chukka;184,7;4,5;Nero
Clarks;Emily Beales Donna;189,88;4,2;Nero
Clarks;Leisa Janna, Sandali Donna, US Women;194,57;4,2;Nero
Clarks;Declan Mix Sandali Donna;195,27;3,8;Nero
Clarks;Marie Sail, Mocassino Donna;203,42;4,5;Nero
Clarks;Un Damson Step, Scarpe décolleté Donna;213,24;3,8;Nero
Clarks;Women's Emslie Warren Slip-on Loafer,Black Leather,8 M US;211,87;4,1;Nero
Clarks;26128350, Mocassino Donna;249,2;4,2;Nero
Clarks;Deva Mae Scarpe décolleté Donna;228,98;5;Nero
Clarks;Mocassini da donna Suttyn Walk, Pelle nera, 41 EU;311,08;4;Nero
Clarks;Sandali da donna Tuleah Sun con zeppa;313,94;4;Nero
Geox;D Spherica A, Sneakers Donna;65,1;4,5;Rosso
Timberland;Mocassini Classic Boat 2 Eye Codice TB0A2Q9XEIW Rosso;35,7;4,6;Rosso
Clarks;Freckle Ice, Ballerine Donna;56,56;4,4;Rosso
Clarks;Passeggiata Mayhill, Scarpe da Ginnastica Donna;98,28;4,1;Rosso
Geox;D Spherica Actif, Scarpe da Ginnastica Donna;98,28;1;Rosso
Geox;D Activart A, Scarpe da Ginnastica Donna;73,69;3,7;Rosso
Geox;D Cloridie A, Moccasin Donna;49,26;4,2;Rosso
Geox;D Bleyze H, Scarpe Donna;74,03;3,8;Rosso
Geox;D Iridea A, Moccasin Donna;74,03;4,5;Rosso
Geox;D Pg1x B ABX A, Scarpe da Ginnastica Donna;65,17;4,1;Rosso
Clarks;Linvale Jerica, Scarpe col Tacco Punta Chiusa Donna;38,46;4,6;Rosso
Geox;D Spherica Ec1 A, Scarpe Donna;90,08;4,1;Rosso
Geox;D Faviola C, Décolleté Donna;90,08;3,8;Rosso
Geox;D Annytah Moc A, Mocassino Donna;45,74;4,4;Rosso
Geox;D Palmaria B, Balletto Piatto Donna;122,87;4,1;Rosso
Geox;D Giselda A, Pompa Donna;122,87;3,4;Rosso
Clarks;Malvarosa Passeggiata, Scarpe da Ginnastica Donna;53,59;4,1;Rosso
Geox;D Spherica Ec1 A, Moccasin Donna;77,47;4,3;Rosso
Clarks;Fawna Soft, Ballerine Donna;109,9;3,8;Rosso
Geox;D Bleyze B, Mocassini Donna;109,9;4,2;Rosso
Clarks;Hollyhock Walk, Scarpe da Ginnastica Donna;57,13;4;Rosso
Clarks;Calla Facilità, Mocassino Basso Donna;81,89;4,4;Rosso
Clarks;Tilmont Step, Mocassino Donna;81,89;4,3;Rosso
Geox;D Faviola A, Scarpe Donna;77,18;4;Rosso
Clarks;Funny Dream, Scarpa Mary Jane Donna;89,9;3,8;Rosso
Clarks;Elaina Giada Ballerine Donna;89,9;4,3;Rosso
Geox;D Isotte F, Stivaletti Donna;69,77;5;Rosso
Geox;D Kosmopolis + Grip, Moccasin Donna;109,9;4,3;Rosso
Geox;J Sandal Soleima Gir, Donna;109,9;4,6;Rosso
Geox;D Annytah B, Balletto Piatto Donna;70,99;4,6;Rosso
Geox;D Ischia Corda, Sandali Donna;74,68;4,1;Rosso
Geox;D Braies B ABX B, Sneakers Donna;98,28;4,4;Rosso
Clarks;Un Maui Lace, Scarpe da Ginnastica Donna;98,28;4,9;Rosso
Clarks;Westlynn Ayla, Mocassino Donna;73,75;4;Rosso
Geox;D Calithe A, Scarpe da Ginnastica Donna;44,14;5;Rosso
Clarks;Slipper & Mocassino Mayhill Cove, pelle grezza, da donna, colore: rosso;60,08;4,1;Rosso
Geox;D Leelyan C, Mocassini Donna;34,96;4,2;Rosso
Geox;J Theleven Girl WPF, Scarpe da Ginnastica Donna;57,41;4,4;Rosso
Geox;D Isotte E, Stivali Donna;46,44;4;Rosso
Geox;D Damiana, Stivaletto Donna;52,42;4;Rosso
Geox;D Coronilla D, Stivale alla Caviglia Donna;67,65;4,3;Rosso
Geox;D Iridea D26hrd043, Stivali Donna;34,39;4,2;Rosso
Geox;D Palmaria H, Balletto Piatto Donna;114,67;4;Rosso
Geox;D Iridea D36hrh043, Stivali Donna;114,67;4,2;Rosso
Geox;D Iridea D36hrg043, Stivali Donna;58,71;4;Rosso
Geox;D Brionia A, Mocassino Donna;30,11;4;Rosso
Geox;D Elidia A, Mocassini Donna;59,48;4,1;Rosso
Geox;D BIGLIANA A, Décolleté, Donna;84,98;4,2;Rosso
Geox;D Teulada C, Stivale alla Caviglia Donna;111,47;4,5;Rosso
Clarks;Un Balsa Go, Mocassini Donna;131,07;3,9;Rosso
Geox;D Bulmya B, Scarpe da Ginnastica Donna;131,07;3,8;Rosso
Clarks;Tealite Grace, Sandali a Punta Aperta Donna;81,5;4,1;Rosso
Clarks;Torhill Lo, Stivaletti Bassi con Lacci Unisex-Adulto;70,15;4,7;Rosso
Geox;J Sandal Whinberry G, Donna;59,27;1;Rosso
Clarks;Scarpa 26173851 Torhill Chestnut da donna;69,95;4,5;Rosso
Clarks;Aristella Sun, Sandali Donna;69,95;4,2;Rosso
Timberland;Leather RFID Zip Around Wallet Clutch with Wristlet Strap, Braccialetto Donna, Taglia Unica;106,55;4,2;Rosso
Geox;Donna D Brionia B Sandali;36,61;4,5;Rosso
Geox;Jocker, Scarpe chiuse unisex adulto, Rosso (fucsia), 33;73,76;4,2;Rosso
Clarks;Funny Dream, Scarpa Mary Jane Donna;45,07;4,4;Rosso
Clarks;Giselle Dove, Sandali Donna;;1;Rosso
Clarks;Ezera Walk, Scarpe da Ginnastica Donna;38,14;4,1;Rosso
Geox;J Sandal Karly Girl, Bambina;;4,4;Rosso
Lumberjack;Line, Scarpe con Lacci Donna;39,25;2,6;Rosso
Geox;D Brionia L, Sandali Piatti Donna;62,22;3,8;Rosso
Clarks;Julia Gem, Mocassino Donna;65,49;4,7;Rosso
Geox;D Charyssa C, Balletto Piatto Donna;65,49;4,1;Rosso
Clarks;Sneakers Viola 149852;39;3,9;Rosso
Clarks;Nalle Lace, Scarpe da Ginnastica Donna;65,63;4,2;Rosso
Clarks;Amanda Tealite, Sandali Sportivi Donna;90,16;4,2;Rosso
Geox;D Lipari E, Sandali Donna;90,16;4,2;Rosso
Geox;D Spherica Ec1 A, Moccasin Donna;50,57;4,2;Rosso
Geox;D Sozy S, Sandali Piatti Donna;60,11;4,7;Rosso
Timberland;EKCASCBAY LACLESS RE Red, Sneaker Donna, Rosso (Rot (Red));49,14;4,2;Rosso
Clarks;Maye Ease, Chelsea Boot Donna;53,4;4,2;Rosso
Clarks;Breeze Sea-Appeso, Infradito Donna;50,28;4,3;Rosso
Geox;D Spherica Ec5 D, Sandali Donna;71,5;5;Rosso
Geox;D Flavie, Borsa Donna, Taglia Unica;69,14;4,3;Rosso
Clarks;Brezza Emily Mocassino Donna;66,33;4,5;Rosso
Geox;J Sandal Whinberry G, Donna;79,95;3,9;Rosso
Timberland;Portafoglio in Pelle RFID Flap Cluth Organizer, Donna, Nero o Marrone, Taglia Unica;79,95;4;Rosso
Geox;D Sozy Plus, Sandali Piatti Donna;52,7;3,2;Rosso
Clarks;Powder Puff - sandali da donna - taglia 37.5 (EU) 4.5 (UK);98,28;4;Rosso
Timberland;Carmona Anello Donna Ballerine;59,36;2;Rosso
Clarks;Cerniera Calla, Stivali a metà Polpaccio Donna;83,85;4,2;Rosso
Clarks;Deva Dolly, Stiletto Donna;62,6;5;Rosso
Clarks;Flake Berry, Ballerine Donna, Rosso (Rouge (Wine Patent), 36 EU;64,03;3,9;Rosso
Clarks;Harmonious Day, Tacchi Alti Donna;62,47;4,7;Rosso
Clarks;Brezza Mare, Infradito Donna;44,14;4,7;Rosso
Clarks;Breeze Sea, Infradito Donna;49,07;4,5;Rosso
Clarks;Mocassino Donna Orianna;216,08;4,4;Rosso
Geox;D Liliane, Borsa Donna, Taglia Unica;39,16;4,3;Rosso
Clarks;Breeze Ave II, Scarpe da Ginnastica Donna;195,29;5;Rosso
Clarks;Mocassini Elaina Harbor Donna;195,49;4,3;Rosso
Clarks;Mocassino Breeze da donna, Rosso, 10 US;97,5;4;Rosso
Clarks;Brinkleyflorah, Scarpe da Ginnastica Unisex-Adulto, Rosso, 0 Women/0 Men;181,35;3,7;Rosso
Clarks;Sandali Zeppa Rosso 149643;62,2;4,4;Rosso
Clarks;Rosa Prato, Ballerine Donna;76,74;4,7;Rosso
Clarks;Serena Paige, Mocassino Donna;191,07;4,5;Rosso
Clarks;Mocassini Donna Rena Way;185,49;5;Rosso
Clarks;Flake Berry, Ballerine Donna, Rosso (Rouge (Wine Patent), 37 EU;51,25;3,9;Rosso
Clarks;Sillian 2.0 - Mocassini da donna;185,64;4,2;Rosso
Timberland;Whittier Boat Wedge 42635, Ballerine Donna;203,93;4;Rosso
Clarks;Women's Sharon Form Platform Loafer;180,24;3,7;Rosso
Clarks;Husky Jade Ballerina;207,81;5;Rosso
Clarks;Mocassini da donna Suttyn Walk;97,5;4,2;Rosso
Clarks;Caroline Janna, Scarpe da Ginnastica Donna;202,59;4,2;Rosso
Clarks;Brise Emily, Mocassino Donna;190,64;4,2;Rosso
Clarks;Sneaker Nalle Donna Pizzo;181,47;3,4;Rosso
Clarks;Mocassino Breeze Skip Donna, Rosso, 39 EU;190,64;5;Rosso
Timberland;Ossipee FTK_Ossipee H & L GTX Oxford, Stivali Chukka Bambina;176,96;4,2;Rosso
Clarks;Donna Neiley Pearl Pump;198,89;3,7;Rosso
Clarks;Ballerina da donna Rena Hop Pelle nera EU;184,51;4,2;Rosso
Clarks;Perla di Caroline, Mocassino Donna, AD Template Size;;4,2;Rosso
Clarks;Stile Calla, Mocassino Basso Donna;;4;Rosso
Clarks;Mocassino Breeze Skip Donna, Rosso, 40.5 EU;;4,4;Rosso
Clarks;Nalle Lace, Scarpe da Ginnastica Donna;178,11;4,2;Rosso
Clarks;Arla Glison, Sandali con Cinturino Posteriore Donna;195,27;4,5;Rosso
Clarks;Women's Sharon Sail;151,48;4;Rosso
Clarks;Caroline Cove Oxford da donna;90,18;4;Rosso
Clarks;Margee Eve, Sandali con Tacco Donna;204,91;4;Rosso
Clarks;Lite Cravatta, Oxford Donna;169,39;3,8;Rosso
Clarks;Cora Rouched, Stivaletto Donna;230;4,3;Rosso
Clarks;Maye Facilità, Stivaletto Donna;195,27;3,9;Rosso
Clarks;Ayla River, Mocassino Donna;177,7;4,2;Rosso
Clarks;Women's Canebay Plain Ballet Flat Wine Leather W;173,3;4;Rosso
Clarks;Fara Paige Piatto;209,68;5;Rosso
Clarks;Cora Heather, Mocassino Donna;197,89;4,4;Rosso
Clarks;Sharon Villa, Mocassino Donna;109,95;4,1;Rosso
Clarks;Layton Step Shoes, Scarpe da Ginnastica Donna;240,7;4,4;Rosso
Clarks;Kayleigh Slip, Mocassino Donna;203,85;3,8;Rosso
Clarks;Calla-Stil, Mocassino Donna;212,93;3,1;Rosso
Clarks;Sneaker Caroline Janna Donna, Pelle rossa, 39 EU;223,71;4,5;Rosso
Clarks;Roseville Clog, Zoccoli Donna;97,5;4,4;Rosso
Clarks;Open House - sandali da donna - taglia 41 (EU) 7 (UK);258,74;4,3;Rosso
Clarks;Stivali da donna Maye Palm Fashion;197,56;3,6;Rosso
Clarks;Mocassino da donna Pure Belle;181,41;4,3;Rosso
Clarks;Freckle Ice, Ballerine Donna;241,9;4,2;Rosso
Clarks;Emily Willow, Stivaletto Donna;190,6;4,3;Rosso
Clarks;SARAFYNA Iris Marrone;194,35;3,6;Rosso
Clarks;Sneakers Donna Un Rio Knit Maglia 37.5 EU;184,26;4,6;Rosso
Clarks;Womens Sandals - 4 UK - Clarks Un Capri Step Red Nubuck - Red Nubuck - 6 UK - D;207,45;3,7;Rosso
Clarks;Morso Orianna, Mocassino Donna;234,71;3,6;Rosso
Clarks;Calla Facilità Mocassino basso Donna;195,29;3,9;Rosso
Clarks;Cora Braid Boot, Stivaletto Donna;368,16;4,1;Rosso
Clarks;Mocassino da donna Pure Belle;192,2;5;Rosso
Clarks;Stivali da donna Maye Palm Fashion, Pelle Bordeaux, 8 UK Wide;224,37;3,7;Rosso
Clarks;Espadrillas da donna Serena Paige Suede Slip On, Rosso, 7.5 Wide;183,03;4,1;Rosso
Clarks;Sneaker Caroline Janna Donna, Pelle rossa, 36 EU;180,71;4,4;Rosso
Clarks;Sneaker Caroline Janna Donna, Pelle rossa, 41 EU;176,38;4,4;Rosso
Clarks;Focolare Faye, Stivaletto Donna;213,1;4;Rosso
Clarks;Mocassino da donna Raisie Jump;168,23;4,5;Rosso
Clarks;Mocassino Breeze da donna, Rosso, 6.5;207,66;4;Rosso
Clarks;Wallacraft Lo 68747 - Scarpe da donna scamosciate, colore: Borgogna;183,28;5;Rosso
Clarks;Sillian Greer, Mocassino Donna, 37 EU;180,96;4;Rosso
Clarks;Maye Grace, Stivali Chelsea Donna;240,67;4,2;Rosso
Clarks;Maye Ease, Stivaletto Donna;189,94;3,9;Rosso
Clarks;Mocassino Breeze Skip Donna, Rosso, 39 EU;295,07;5;Rosso
Clarks;Pantofole da donna in pelle scamosciata con colletto lavorato a maglia, fodera in pelliccia sintetica, Bacca, 7 Wide;222,23;4,4;Rosso
Clarks;Serena Brynn, Mocassino Basso Donna;174,27;4,1;Rosso
Clarks;Everlay Dixey, Mocassino Donna, / US Frauen;195,27;4,4;Rosso
Clarks;Emily Step, Mocassino Donna;197,55;4,4;Rosso
Clarks;Mallory Pearl, Mocassino Donna;97,5;4,1;Rosso
Clarks;Brezza Crepuscolo, Stivaletto Donna;109,95;4,2;Rosso
Clarks;Scuff, Sandali a Ciabatta Donna;266,7;4,4;Rosso
Clarks;Mazy Harwich - Stivali da donna;203,73;4,8;Rosso
Clarks;Roseville Aster, Stivaletto Donna, AD Template Size;241,53;4,3;Rosso
Clarks;Teagan Step, Mocassino Donna;236,99;3,9;Rosso
Clarks;UN Capri Step Sandali Infradito Donna Rosso 37 EU;208,49;4;Rosso
Clarks;Open House - sandali da donna - taglia 37 (EU) 4 (UK);173,85;4,2;Rosso
Clarks;Pantofola trapuntata da donna in feltro JMS0783T - Morbida fodera in spugna di peluche - Pantofole per interni ed esterni per le donne;185,74;4,4;Rosso
