Marchio;Nome;Prezzo;Valutazione;Colore
Clarks;Giselle Beach, Sandali con Zeppa Donna;129,9;3;Marrone
Clarks;Ledwick Haley, Stivali alla Moda Donna;129,9;3,7;Marrone
Geox;D Falena B ABX D, Scarpe da Ginnastica Donna;71,51;4,3;Marrone
Geox;D Blomiee E, Scarpe da Ginnastica Donna;106,48;3,1;Marrone
Timberland;Skyla bay 2.0, Scarpe da Ginnastica Donna;106,48;4,2;Marrone
Geox;D Cloridie A, Moccasin Donna;65,17;4,4;Marrone
Geox;D Serilda B, Stivale alla Caviglia Donna;70,14;3,8;Marrone
Geox;D Jaylon 2 B, Moccasin Donna;38,91;4,3;Marrone
Geox;D Maurica B, Scarpe da Ginnastica Donna;45,07;4,2;Marrone
Timberland;Timberland;49,1;4,2;Marrone
Geox;D New Asheel C, Stivale alla Caviglia Donna;91,98;4,1;Marrone
Timberland;Carnaby Cool, Oxford Donna;49,62;3,1;Marrone
Geox;D Zosma A, Scarpe da Ginnastica Donna;75,57;4,3;Marrone
Geox;D Iridea B, Stivaletti Donna;54,61;4,4;Marrone
Geox;D Floretia A, Balletto Piatto Donna;67,81;4,4;Marrone
Geox;Cosmopoli D + Grip, Moccasin Donna;35,11;4,8;Marrone
Geox;D Sorapis + Grip B, Sandali Sportivi Donna;52,76;4,4;Marrone
Geox;D Tabelya A, Sneakers Donna;70,92;5;Marrone
Geox;D Giselda R A, Pompa Donna;47,43;4,2;Marrone
Timberland;Greyfield Warm Lined, Scarpa Donna;83,6;4,8;Marrone
Geox;D Annytah Moc, Moccasin Donna;98,28;4;Marrone
Geox;D Elidea Wedge A, Stivale alla Caviglia Donna;98,28;4,2;Marrone
Clarks;Jenette Ease, Ballet Flat Donna;65,35;4;Marrone
Geox;D Giselda R C, Classico Donna;90,16;4,8;Marrone
Geox;D Leelyan C, Mocassini Donna;106,48;4;Marrone
Geox;D New Marykarmen A, Sandalo con Tacco Donna;106,48;3,8;Marrone
Geox;D Myria B, Scarpe da Ginnastica Donna;54,83;4,5;Marrone
Geox;D Coronilla, Pompa Donna;57,23;3,2;Marrone
Geox;J Sandal Costarei Gi, Donna;61,53;3,5;Marrone
Geox;D Spherica Ec1 A, Scarpe Donna;98,28;4,6;Marrone
Geox;D Eolie F, Sandali con Zeppa Donna;98,28;4,2;Marrone
Geox;D Sozy S B, Sandali Piatti Donna;75,41;4,4;Marrone
Clarks;Sogno Divertente, Scarpe da Ginnastica Donna, Pelle Vino, 39 EU;37,04;4,8;Marrone
Geox;D Giselda C, Stivale alla Caviglia Donna;77,47;4,1;Marrone
Geox;D Sukie B, Sneakers Donna;109,9;4;Marrone
Geox;D Jaylon 2 A, Mocassino Donna;109,9;4,2;Marrone
Geox;D Brionia A, Mocassino Donna;48,51;4,8;Marrone
Clarks;Teresa Passo, Scarpe décolleté Donna;65,61;4,2;Marrone
Geox;D Palmaria C, Loafer Flat Donna;89,9;4,6;Marrone
Geox;D Kosmopolis + Grip, Moccasin Donna;89,9;3,8;Marrone
Geox;D Xand 2.2s A, Sandalo con Zeppa Donna;62,13;4,3;Marrone
Clarks;Hollyhock Walk, Scarpe da Ginnastica Donna;104,25;5;Marrone
Timberland;Capri Sunset Wedge, Ciabatte Donna;149,9;4,2;Marrone
Clarks;Top Chamberly, Stivali Chelsea Donna;149,9;4,1;Marrone
Geox;D BIGLIANA A, Décolleté, Donna;52,18;4,3;Marrone
Clarks;Havisham Top, Stivali Chelsea Donna;70,01;3;Marrone
Geox;D Brionia, Sandali Donna;73,69;4,4;Marrone
Clarks;Serina35 Cross, Sandali Donna;73,69;4,6;Marrone
Geox;D Damiana, Stivaletto Donna;16,15;5;Marrone
Clarks;Quercia Havisham, Scarpa Mary Jane Donna;78,49;5;Marrone
Geox;D Felicity B, Stivale alla Caviglia Donna;63,85;3;Marrone
Geox;D Calithe A, Scarpe da Ginnastica Donna;86,83;4,3;Marrone
Clarks;Jaylan Ray, Sandali Donna;98,28;4,6;Marrone
Geox;D New Kency A, Scarpe da Ginnastica Donna;98,28;4,2;Marrone
Geox;D Ilde A, Scarpe da Ginnastica Donna;53,27;3,8;Marrone
Clarks;Freckle Bar, Ballet Flat Donna;111,39;3,8;Marrone
Geox;D Marykarmen A, Sandali con Zeppa Donna;91,5;4,1;Marrone
Clarks;Ambyrlyn Rubino, Scarpe décolleté Donna;52,75;3,9;Marrone
Geox;D Catria D, Stivale alla Caviglia Donna;70,93;4,4;Marrone
Clarks;Una Rio Zip, Scarpe da Ginnastica Donna;56,8;1;Marrone
Geox;D Sozy S Y, Sandali Piatti Donna;90,16;3,7;Marrone
Geox;D Palmaria B, Balletto Piatto Donna;90,16;5;Marrone
Clarks;Aristella Sun, Sandali Donna;40,17;4,3;Marrone
Geox;D Sozy S, Sandali Piatti Donna;57,3;4,5;Marrone
Geox;D Diamanta D, Scarpe da Ginnastica Donna;57,3;4;Marrone
Clarks;Alda Strap, Sandali Donna;53,27;4,3;Marrone
Clarks;Clarkwell Demi, Scarpe Chukka Donna;62,19;4,3;Marrone
Geox;D Myria C, Scarpe da Ginnastica Donna;62,19;5;Marrone
Timberland;Carnaby Cool, Stivali Chelsea Donna;45,96;4;Marrone
Geox;D Serilda 60 C, Moccasin Donna;110,23;2,5;Marrone
Geox;D New Aneko B ABX B, Scarpe da Ginnastica Donna;119,9;4,4;Marrone
Clarks;Mayhill Top, Stivali Chelsea Donna;119,9;5;Marrone
Geox;D Xand 2.2s B, Sandali con Zeppa Donna;85,26;4,2;Marrone
Clarks;Mocassino Orinoco 2, Donna;122,87;5;Marrone
Geox;D Iridea D04hrb000, Stivali Donna;122,87;3,7;Marrone
Geox;D Panarea D, Sandali con Zeppa Donna;61,07;5;Marrone
Geox;D Vega A, Sandali Punta Aperta Donna;67,2;4,3;Marrone
Geox;D Gelsa Low A, Sandali con Zeppa Donna;98,28;3,3;Marrone
Clarks;Keirsta Faye, Stivali alla Moda Donna;98,28;4,1;Marrone
Timberland;Carnaby Cool, Stivali Donna;40,16;4,5;Marrone
Geox;D Damiana E, Stivaletti Donna;44,17;4,5;Marrone
Clarks;Maye Bella, Stivali alla Moda Donna;98,28;4,2;Marrone
Clarks;Sogno Divertente, Scarpe da Ginnastica Donna, Pelle Vino, 37 EU;98,28;1;Marrone
Geox;D Iridea F, Stivaletti Donna;62,33;4,4;Marrone
Geox;D Elidia A, Mocassini Donna;49,14;4,1;Marrone
Clarks;Maritime May, Sandali Donna;48,78;3,9;Marrone
Geox;D Spherica Ec1 C, Stivaletti Donna;71,84;4,4;Marrone
Geox;D Marykarmen D358qa000, Sandalo Donna;135,25;4,2;Marrone
Clarks;Clarks Women's Clarkwell Demi Chukka Boot;98,32;4,7;Marrone
Geox;D Bulmya B, Scarpe da Ginnastica Donna;80,27;3,8;Marrone
Clarks;Aristella Rose, Sandali Donna;76,85;4,5;Marrone
Geox;D Allenie B, Scarpe da Ginnastica Donna;98,28;3,8;Marrone
Geox;D Iridea D36hrd000, Stivali Donna;59,48;4,2;Marrone
Geox;D Elidea C, Stivale alla Caviglia Donna;46,72;3,8;Marrone
Geox;D Sozy S X, Sandali Donna;59,02;4,4;Marrone
Geox;D Pheby 80 E, Pompa Donna;114,67;4,1;Marrone
Geox;D Brionia A, Scarpe da Casa Donna;114,67;3,9;Marrone
Clarks;Arwell Sling, Sandali Donna;55,47;4,2;Marrone
Geox;D Felicity A, Stivale alla Caviglia Donna;73,69;4,5;Marrone
Geox;D Felicity NP ABX A, Stivale alla Caviglia Donna;73,69;4,3;Marrone
Clarks;April Cove, Sandali Sportivi Donna;57,32;4,3;Marrone
Geox;D Eolie A, Sandali con Zeppa Donna;81,89;4,3;Marrone
Geox;D Blomiee D, Scarpe da Ginnastica Donna;81,89;4,5;Marrone
Geox;D Blomiee F, Scarpe da Ginnastica Donna;73,76;4,5;Marrone
Clarks;Laina Rae, Scarpe con Tacco Donna;73,41;5;Marrone
Geox;D Xand 2.1s, Sandal Donna;56,78;5;Marrone
Geox;D Xand 2s B, Sandali Donna;122,87;4,2;Marrone
Geox;D Giselda R D, Stivale alla Caviglia Donna;122,87;4;Marrone
Clarks;Fibbia Neva, Anfibi Donna;118,1;4,6;Marrone
Clarks;Funny Dream, Scarpa Mary Jane Donna;149,9;4;Marrone
Geox;D Palmaria H, Balletto Piatto Donna;149,9;4,4;Marrone
Geox;D Brionia F, Sandali Donna;65,49;4,7;Marrone
Clarks;Passeggiata Adella, Oxford Donna;37,49;4,3;Marrone
Geox;D Spherica 4x4 B ABX, Scarpe da Ginnastica Donna;39,03;4,5;Marrone
Geox;D Sozy Q A, Sandali Piatti Donna;63,53;4;Marrone
Geox;D Blomiee E, Scarpe da Ginnastica Donna;68,99;4,5;Marrone
Geox;D Ponza A, Sandali con Zeppa Donna;99,9;4,5;Marrone
Geox;D Diantha, Sandalo Donna;99,9;3,6;Marrone
Clarks;Westlynn Ayla, Mocassino Donna;63,75;4,5;Marrone
Clarks;Tuscan Cross, Sandali Donna;45,98;4,2;Marrone
Geox;D Dandra, Sandalo Donna;73,76;5;Marrone
Geox;D Naileen A, Sandali Piatti Donna;60,07;4,2;Marrone
Geox;D Ischia Corda C, Sandali con Zeppa Donna;64,75;5;Marrone
Geox;D Elidea D, Piattaforma Donna;30,3;4,4;Marrone
Geox;D Doralea B, Sneakers Donna;58,16;4,2;Marrone
Geox;D Bulmya A, Sneakers Donna;94,84;4,5;Marrone
Geox;D Felicity G, Stivaletti Donna;129,9;3,3;Marrone
Geox;D Felicity, Stivale alla Caviglia Donna;129,9;4,4;Marrone
Clarks;Stile Orinoco2, Stivali alla Moda Donna;72,48;4;Marrone
Geox;D New Eraklia 50, Sandalo Donna;43,57;4,1;Marrone
Geox;D Spherica Ec5 C, Sandali Sportivi Donna;;4,2;Marrone
Geox;D Brionia L, Sandali Piatti Donna;50;5;Marrone
Clarks;Malwood Lace, Oxford Uomo;85,18;4,1;Marrone
Geox;D Xand 2s C, Sandali Sportivi Donna;90,08;4,5;Marrone
Geox;D Laudara, Sandalo Donna;90,08;4,2;Marrone
Timberland;Linden Woods WP 6 inch, Stivali alla Moda Donna;59,01;4,2;Marrone
Geox;Donna D Catria A Stivaletti;98,28;3,9;Marrone
Geox;D Aerantis 4x4 B ABX, Stivaletti Donna;98,28;4,2;Marrone
Clarks;Coast Cross, Sandali scorrevoli Donna;63,94;4,1;Marrone
Geox;D Felicity, Stivali Alti al Ginocchio Donna;66,98;4,1;Marrone
Geox;D Iridea D36hre000, Stivali Donna;53,4;4,2;Marrone
Geox;D Teulada D, Mary Jane Donna;163,93;3,6;Marrone
Geox;D Sozy S U, Sandali Piatti Donna;68,3;3,7;Marrone
Geox;D Dandra A, Sandali scorrevoli Donna;45,07;4,3;Marrone
Geox;D Serilda A, Stivali alla Moda Donna;63,41;4,6;Marrone
Geox;D Dandra B, Sandali con Zeppa Donna;100,75;3,8;Marrone
Geox;D Larysse, Stivaletti Donna;147,54;3,8;Marrone
Geox;D Brionia, Sandali Donna;147,54;4,2;Marrone
Geox;D Ischia Corda, Sandali Donna;94,31;3,9;Marrone
Geox;D. Ischia Corda, Sandali Donna;139,9;4,2;Marrone
Geox;D Sozy S, Sandali Piatti Donna;139,9;4,2;Marrone
Clarks;Desirae Lily, Sandali con Tacco Donna;49,41;4,4;Marrone
Geox;D Leuca C, Sandali Piatti Donna;61,99;3,6;Marrone
Geox;D Spherica Ec5w, Sandal Donna;66,96;4,2;Marrone
Clarks;Trish Strap, Stivali Chelsea Donna;78,3;3,7;Marrone
Geox;D Brionia, Sandali Donna;131,07;4,6;Marrone
Geox;D Sozy S D, Sandali Piatti Donna;131,07;4,4;Marrone
Geox;D Falena B ABX, Caviglia Barca Donna;80,07;3,9;Marrone
Clarks;Karsea Strap, Sandali Donna;114,67;4,2;Marrone
Geox;D New Eraklia 50, Sandalo Donna;114,67;4;Marrone
Clarks;Karsea Mule, Slide Sandal Donna;45,87;4,2;Marrone
Clarks;Rose Ease, Sandali Donna;70,14;4,2;Marrone
Clarks;Kyarra Aster, Sandali con Zeppa Donna;48,73;4,2;Marrone
Geox;D New Eraklia 80, Sandal Donna;66,17;4;Marrone
Clarks;Lana Shore, Sandali con Zeppa Donna;98,28;4;Marrone
Clarks;Sandalo piatto da Donna Coast Shine;98,28;4,5;Marrone
Clarks;Karsea Straps, Sandal Donna;48,65;4,3;Marrone
Geox;D Sthellae B, Sandali scorrevoli Donna;49,03;4;Marrone
Clarks;Lana Beach, Sandali Bassi Donna;52,43;3,9;Marrone
Timberland;Fisherman Sandal, Donna;48,19;3,7;Marrone
Geox;Cosmopoli D + Grip, Moccasin Donna;64,88;3,1;Marrone
Geox;Donna D Brionia B Sandali;92,56;4,2;Marrone
Clarks;Trish Strap, Stivali Chelsea Donna;65,49;4,2;Marrone
Geox;D Giselda C, Stivale alla Caviglia Donna;68,85;4,8;Marrone
Clarks;Serina35 Sandali Cross Suede In Tan;104,25;4,1;Marrone
Geox;D Laudara, Sandalo Donna;149,9;3,7;Marrone
Geox;D Larysse, Stivaletti Donna;149,9;4,3;Marrone
Timberland;Timberland;49,1;4,5;Marrone
Clarks;Mira bay, Sandalo Donna;63,41;4,6;Marrone
Timberland;Allington 6in Lace Up (Wide Fit);62,06;4,2;Marrone
Clarks;Maye Strap, Chelsea Boot Donna;66,19;3,2;Marrone
Geox;Carissa, Ballerine Donna;70,32;5;Marrone
Geox;D Elidea A, Moccasin Donna;39,03;3,8;Marrone
Geox;D Annytah C, Ballerine Donna;77,1;3,9;Marrone
Geox;D Aurely 50 B, Sandalo con Tacco Donna;106,48;3,5;Marrone
Geox;D Cloridie B, Moccasin Donna;106,48;4,6;Marrone
Geox;D Elidea B, Stivale alla Caviglia Donna;52,08;4,1;Marrone
Geox;D Dandra B, Sandali Donna;77,8;4,4;Marrone
Geox;D Felicity A, Stivali Donna;81,89;4;Marrone
Geox;D Iridea B, Stivale alla Caviglia Donna;81,89;4,3;Marrone
Geox;D Blomiee D, Scarpe da Ginnastica Donna;49,93;3,8;Marrone
Clarks;Clarkwell Demi, Scarpe Chukka Donna;106,48;4,4;Marrone
Clarks;Torhill Lo, Uomo;106,48;4;Marrone
Clarks;Fawna Jane, Ballerine Donna;120,69;4,3;Marrone
Geox;D Lauressa B, Sneakers Donna;149,9;3,8;Marrone
Geox;D Vilde C, Moccasin Donna;149,9;5;Marrone
Lumberjack;Michiel SWH8513 Total Black Scarponcini Beatles per Donna in pelle;47,09;4,2;Marrone
Clarks;Janey Mae, Scarpe Stringate Derby Donna;112,07;4,2;Marrone
Geox;D Dalyla B Abx, Scarpone Da Neve Donna;155,66;3,9;Marrone
Clarks;Clarks Women's Ambyrlyn Ruby Heeled Sandal;155,66;4,5;Marrone
Timberland;Hiker Donna White Ledge Waterproof;116,73;4,6;Marrone
Lumberjack;Kristy, Stivaletti Bassi con Lacci Donna;122,87;4;Marrone
Lumberjack;Monica, Stivali alla Moda Donna;122,87;3,6;Marrone
Timberland;Carnaby Cool Biker Boot, Stivale alla Caviglia Donna;76,26;4,2;Marrone
Clarks;Maye Ease, Chelsea Boot Donna;108,69;4,6;Marrone
Geox;D Larysse, Stivale alla Caviglia Donna;90,57;5;Marrone
Geox;Geox Women's D Spherica 4x4 B ABX Ankle Boot;92,23;3,6;Marrone
Geox;D Bigliana 90 A, Stivaletti Donna;63,92;4;Marrone
Clarks;Top Chamberly, Stivali Chelsea Donna;52,75;5;Marrone
Clarks;Ashland Lane Q, Mocassino da infilare Donna, US Frauen;70,63;4,4;Marrone
Geox;D BIGLIANA A, Décolleté, Donna;70,93;4,2;Marrone
Geox;D Iridea D04hrb000, Stivali Donna;44,17;3,7;Marrone
Clarks;Westlynn Ayla, Mocassino Donna;98,28;4,5;Marrone
Geox;D New Eraklia 80, Sandal Donna;98,28;4;Marrone
Geox;D Spherica Ec1, Mocassino Donna;73,76;3,8;Marrone
Timberland;White Ledge Hiker WP, Barca da Escursionismo Donna;77,69;4,4;Marrone
Clarks;Lana Shore, Sandali con Zeppa Donna;119,9;4;Marrone
Geox;D Elidea D, Piattaforma Donna;119,9;5;Marrone
Clarks;Stile Orinoco2, Stivali alla Moda Donna;68,93;4,8;Marrone
Geox;D Palmaria C, Loafer Flat Donna;48,65;4,2;Marrone
Clarks;Malwood Lace, Oxford Uomo;94,84;2,5;Marrone
Geox;D Iridea D, Stivali alla Moda Donna;129,9;4,2;Marrone
Geox;D Vilde, Stivale alla Caviglia Donna;129,9;4,1;Marrone
Geox;D Iridea D36hre000, Stivali Donna;63,94;3,8;Marrone
Geox;D Sozy S, Sandali Piatti Donna;63,85;4;Marrone
Geox;D Sthellae B, Sandali scorrevoli Donna;163,93;3,8;Marrone
Geox;D Allenie B, Scarpe da Ginnastica Donna;69,51;3,3;Marrone
Geox;D Felicity, Stivale alla Caviglia Donna;139,26;4,1;Marrone
Geox;D Elidia A, Mocassini Donna;139,26;4,2;Marrone
Geox;Donna D Brionia B Sandali;48,73;4,2;Marrone
Clarks;Maye Ease, Chelsea Boot Donna;122,87;4,2;Marrone
Clarks;Trish Strap, Stivali Chelsea Donna;122,87;4,5;Marrone
Geox;D Marsilea C, Loafer Flat Donna;78,3;4,1;Marrone
Geox;D Lamidie + Grip ABX, Stivale alla Caviglia Donna;131,07;4,3;Marrone
Timberland;Hiker Donna White Ledge Waterproof;131,07;4,2;Marrone
Clarks;Serina35 Sandali Cross Suede In Tan;49,61;3,7;Marrone
Geox;D Laudara, Sandalo Donna;73,69;4,3;Marrone
Clarks;Clarks Women's Airabell Zip Chelsea Boot;73,69;4,5;Marrone
Geox;D Iridea B ABX, Stivale alla Caviglia Donna;48,19;4,6;Marrone
Geox;D Larysse, Stivaletti Donna;73,41;4,2;Marrone
Timberland;Timberland;59,01;3,2;Marrone
Clarks;Mira bay, Sandalo Donna;98,28;3,8;Marrone
Timberland;Allington 6in Lace Up (Wide Fit);98,28;3,9;Marrone
Clarks;Maye Strap, Chelsea Boot Donna;59,48;3,6;Marrone
Geox;Carissa, Ballerine Donna;65,49;3,5;Marrone
Geox;D Annytah C, Ballerine Donna;71,08;3;Marrone
Geox;D Aurely 50 B, Sandalo con Tacco Donna;68,85;4,1;Marrone
Geox;D Bigliana 90 A, Stivaletti Donna;58,8;4,4;Marrone
Geox;D Cloridie B, Moccasin Donna;140,09;2,8;Marrone
Clarks;Orinoco2 Alto, Stivali alla Moda Donna;136,13;4,3;Marrone
Geox;D Dandra B, Sandali Donna;170;3,8;Marrone
Geox;D Felicity A, Stivali Donna;170;4;Marrone
Geox;D Felicity C, Stivali alla Moda Donna;103,32;4,3;Marrone
Clarks;Torhill Lo, Uomo;155,66;4,4;Marrone
Clarks;Fawna Jane, Ballerine Donna;155,66;4;Marrone
Geox;D Vilde C, Moccasin Donna;90,57;3,8;Marrone
Lumberjack;Michiel SWH8513 Total Black Scarponcini Beatles per Donna in pelle;63,92;5;Marrone
Clarks;Scene Zip, Stivali Chelsea Donna;71,59;4,3;Marrone
Clarks;Janey Mae, Scarpe Stringate Derby Donna;71,16;4,2;Marrone
Geox;D Dalyla B Abx, Scarpone Da Neve Donna;76,86;4,2;Marrone
Clarks;Funny Cedar, Stivali alla Moda Donna, Verde Oliva Scuro, 39.5 EU;58,68;3,6;Marrone
Geox;D Blandine, Borsa Donna, Taglia Unica;66,76;5;Marrone
Clarks;Maye Grace, Stivali Chelsea Donna;106,56;4,4;Marrone
Clarks;Lizby Cross, Sandali con Zeppa Donna;106,56;4,1;Marrone
Geox;D Felicity NP ABX B, Stivali Donna;114,67;2,8;Marrone
Lumberjack;Monica, Stivali alla Moda Donna;71,15;4;Marrone
Timberland;Carnaby Cool Biker Boot, Stivale alla Caviglia Donna;61,76;3,6;Marrone
Geox;D Felicità, Stivaletto Donna;78,32;5;Marrone
Geox;D Larysse, Stivale alla Caviglia Donna;75,52;4,6;Marrone
Geox;Geox Women's D Spherica 4x4 B ABX Ankle Boot;55,3;5;Marrone
Clarks;Jemsa Cross, Sandali Donna;56,98;4,2;Marrone
Clarks;Ambyrlyn Ruby, Sandali con Tacco Donna;90,16;4,1;Marrone
Clarks;Clarkwell Hall, Stivali alla Moda Donna;86,66;4,4;Marrone
Timberland;Stivali Greyfield Field Mid Codice Tb0A2Ft6Em5;67,35;5;Marrone
Clarks;Orinoco2 Up, Stivali alla Moda Donna;112,93;3,8;Marrone
Geox;D New Eraklia 80 D, Sandalo con Tacco Donna;83,87;3,6;Marrone
Geox;D Larysse B, Stivali Donna;45,7;3,7;Marrone
Clarks;Cinturino Clarkwell, Stivali alla Moda Donna;48,76;4,2;Marrone
Clarks;Nalle Lace, Scarpe da Ginnastica Donna;113,64;4,1;Marrone
Geox;D Brionia High G, Sandali Donna;159,9;4,1;Marrone
Geox;D Spherica Ec4.1 A, Scarpe da Ginnastica Donna;159,9;4,1;Marrone
Geox;D New Brionia High A, Sandali Piatti Donna;96,01;4,2;Marrone
Geox;D Catria, Stivale alla Caviglia Donna;139,26;4,6;Marrone
Geox;D Felicity, Stivali Alti al Ginocchio Donna;139,26;3,9;Marrone
Geox;D Iridea C, Stivali Donna;62,65;4,2;Marrone
Geox;D Felicity, Stivali Alti al Ginocchio Donna;81,07;4,2;Marrone
Geox;D Palmaria J, Loafer Flat Donna;155,66;4,1;Marrone
Geox;D Iridea M, Stivali Donna;155,66;4,6;Marrone
Lumberjack;Ankle Boot Cotto Dk Brown;98,12;5;Marrone
Timberland;Tillston 6 inch Double Collar;108,41;4,1;Marrone
Geox;D Iridea D04hrc000, Stivali Donna;159,9;4,7;Marrone
Geox;D Dalyla B ABX D, Stivaletti Donna;159,9;4,4;Marrone
Geox;D New Asheel, Stivale alla Caviglia Donna;105,8;4,5;Marrone
Timberland;Euro Rock, Stivali Unisex-Adulto;120,65;4,2;Marrone
Timberland;Bambino Euro Sprint Stivali senza chiusura;90,9;4,2;Marrone
Clarks;Caroline Janna, Scarpe da Ginnastica Donna;76,07;4,4;Marrone
Geox;D Anylla Wedge C, Stivaletti Donna;73,77;4,3;Marrone
Clarks;Padmora, Oxford Donna;88,51;4;Marrone
Geox;D Serilda G, Stivale alla Caviglia Donna;106,48;4,5;Marrone
Geox;D Spherica Actif X2, Stivale alla Caviglia Donna;147,48;4,2;Marrone
Geox;D Iridea, Stivaletti Donna;95,04;3,6;Marrone
Clarks;Corsia di Tivoli, Stivali alla Moda Donna;81,89;4;Marrone
Geox;D Nhenbus B, Stivali Donna;80,33;4,5;Marrone
Clarks;Clarkwell Lace, Stivali alla Moda Donna;90,08;4,4;Marrone
Lumberjack;Karol, Sandali a Ciabatta Donna;81,02;3,5;Marrone
Geox;D Xand 2s E, Sandalo Donna;117,21;4,4;Marrone
Geox;D Giulila, Stivaletti Donna;123,43;4,2;Marrone
Geox;D Iridea, Stivaletti Donna;54,76;3,8;Marrone
Geox;D Palmaria J, Mocassino Donna, Cognac, 38 EU;119,79;4,1;Marrone
Geox;D Brionia, Sandali Donna;108,4;4;Marrone
Clarks;Desert Boot 001037785, Stivaletti donna;98,36;3,5;Marrone
Clarks;Orinoco Club, Stivali Chelsea Donna;179;4,4;Marrone
Clarks;Torhill Bee, Donna;160,89;4,3;Marrone
Timberland;Waterville 6 inch Basic Waterproof, Stivali Stringati Donna;175;4;Marrone
Clarks;Teresa Skip Stivaletti Donna;175;4,2;Marrone
Timberland;Carnaby Cool Basic Warm Pull On WR, Chelsea Boot Donna;90,14;4,2;Marrone
Clarks;CLARKWELL Hall;65,49;4,8;Marrone
Geox;D New Sthellae A, Sandalo Piatto Donna;48,64;4,4;Marrone
Geox;D Zene S A, Borsa Donna, Taglia Unica;133,57;4,3;Marrone
Timberland;Scarpe invernali da donna., Donna, 8646A, dunkelbraun, 39,5;84,14;3,7;Marrone
Clarks;Orinoco Spice, Stivali Donna;98,76;4,4;Marrone
Geox;D Arielle A, Borsa Donna, Taglia Unica;107,38;5;Marrone
Clarks;Maye Shine, Stivali alla Moda Donna;114,75;4,4;Marrone
Timberland;Linden Woods 6 inch WR, Stivali Donna;114,75;3,8;Marrone
Timberland;Timberland Women's Nellie Chukka Leather SDE Ankle Boots;105,8;4;Marrone
Clarks;Bubble???? ??ashland ????ashland Bubble???? Ashland?????? ????ashland Bubble, Mocassino Donna, / US Frauen;23,77;4,1;Marrone
Timberland;Ellis Street, Stivali Chelsea Donna;81,34;3,2;Marrone
Geox;D Oliviera + Grip A, Scarpe da Ginnastica Donna;62,17;4,1;Marrone
Geox;D Narcisia B, Borsa Donna, Taglia Unica;102,34;4,5;Marrone
Geox;D Solangy A, Borsa Donna, Taglia Unica;51,02;5;Marrone
Timberland;Carnaby Cool Basic Chelsea, Stivali Donna;52,72;5;Marrone
Clarks;Stivaletti Neva Lo Donna;65,51;4,4;Marrone
Timberland;6 inch Quilt (Toddler), Stivali Unisex-Bambini e Ragazzi;75,5;4;Marrone
Clarks;Emmalae Iris, Sandali Donna;138,8;4,3;Marrone
Geox;D Nebula X A, Scarpe da Ginnastica Basse Bambine e Ragazze;79,02;5;Marrone
Geox;D Kosmopolis + Grip, Moccasin Donna;130;4,4;Marrone
Timberland;6 in Premium Waterproof (Wide Fit) - Stivali Classici Donna, Giallo (Wheat Nubuck), 36 EU;130;3,9;Marrone
Timberland;6 inch Premium Waterproof, Stivali Stringati Donna;107,72;4;Marrone
Geox;D Gardenia A, Sandali con Plateau Donna;106,48;4,2;Marrone
Timberland;Chukka uomo Elmhurst;102,39;3,9;Marrone
Clarks;Clarks Women's Wallabeeevo Sneaker;70,46;5;Marrone
Clarks;Paizlee Nora, Zoccoli Donna;48,45;4,4;Marrone
Clarks;Rifinitura A Camera, Anfibi Donna;83,17;4,2;Marrone
Clarks;Kassanda Lily, Sandali Donna;108,94;4,5;Marrone
Clarks;Costa Desirae, Sandali con Tacco Donna;55,74;5;Marrone
Geox;D Clarissy A, Borsa Donna, Taglia Unica;95,52;4,1;Marrone
Geox;D Veriana D, Borsa Donna, Taglia Unica;114,67;5;Marrone
Geox;D New Lise NP ABX A, Stivaletti Donna;98,28;4,4;Marrone
Geox;D Blandine A, Borsa Donna, Taglia Unica;87,5;4,8;Marrone
Geox;D Virnilisa 65 S A, Sandalo con Tacco Donna;123,85;4,7;Marrone
Clarks;Un Perri Way, Sandali con Cinturino alla Caviglia Donna;62,66;4;Marrone
Geox;Geox Women's D Palmaria J Loafer Flat;106,48;4,2;Marrone
Geox;D Bulmya B, Scarpe da Ginnastica Donna;105,59;4,3;Marrone
Clarks;Breeze Sea-Appeso, Infradito Donna;76,55;4,3;Marrone
Geox;D Etheni B, Borsa Donna, Taglia Unica;160,62;4,4;Marrone
Timberland;6 in Classic FTC_6 in Premium WP Boot, Stivali Unisex-Bambini;212,49;4,3;Marrone
Geox;D Spherica Ecub-1 A Trainers EU 38;212,49;4,1;Marrone
Geox;D Maygea, Borsa Donna, Taglia Unica;81,18;4,1;Marrone
Geox;D Spherica Ecub-1 A Trainers EU 39;110,89;3,1;Marrone
Clarks;Wallabeeevo, Scarpe da Ginnastica Donna;76,01;4,3;Marrone
Timberland;15,2 Cm, Hochwertig, Wasserdicht, Stivali Donna;102,34;4;Marrone
Clarks;Padmora, Oxford Donna;114,75;5;Marrone
Clarks;Hearth Rose - Stivali da donna a metà polpaccio;114,75;4,2;Marrone
Geox;D Etheni, Borsa Donna, Taglia Unica;90,21;4,2;Marrone
Clarks;Wallabeeevo, Scarpe da Ginnastica Donna;98,28;4,2;Marrone
Clarks;Sandali Kyarra Joy con zeppa;98,28;5;Marrone
Timberland;Timberland Women's Carnaby Cool Basic Chelsea Boot;57,37;5;Marrone
Geox;D Cosmopolis + Grip, Moccasin Donna;93,44;4,1;Marrone
Clarks;CALENNE CLARA BRONZE;86,48;4,5;Marrone
Geox;D Serilda C, Stivale alla Caviglia Donna;57,4;4,3;Marrone
Geox;D Irenia A, Borsa Donna, Taglia Unica;75;4;Marrone
Geox;D Danielye, Borsa Donna, Taglia Unica;39,95;4;Marrone
Clarks;Sandali Con Strappi Marrone 26140602 MARRONE 37;69,5;4,1;Marrone
Geox;D Irenie, Borsa Donna, Taglia Unica;139,26;5;Marrone
Geox;D Olympiy A, Borsa Donna, Taglia Unica;88,35;5;Marrone
Geox;D643YB 00022 Stivaletto Donna;56,11;3,7;Marrone
Geox;D Felicity NP ABX, Caviglia Barca Donna;53,28;4,5;Marrone
Geox;D Brionia High, Sandal Donna;120,76;5;Marrone
Clarks;Wallabeeevosh, Donna;65,49;4,7;Marrone
Geox;D Maddalusia A, Sandalo Scorrevole Donna;54,02;4,3;Marrone
Clarks;Sandali Kimmei Twist In Pelle Tan;156,99;4,5;Marrone
Clarks;Brezza Mare, Infradito Donna;;4,2;Marrone
Clarks;Mocassini Elaina Harbor Donna;42,83;4,5;Marrone
Timberland;Leather RFID Zip Around Wallet Clutch with Wristlet Strap, Braccialetto Donna, Taglia Unica;96,84;4,1;Marrone
Clarks;Janey Mae, Ballerine Donna;56,52;4,2;Marrone
Geox;D Veriana A, Borsa Donna, Taglia Unica;55,88;4,5;Marrone
Timberland;BARESTEP LACE;369,62;4,4;Marrone
Geox;D Faviola C, Décolleté Donna;54,02;4,2;Marrone
Clarks;Stivaletti da Donna con cinturino Maye;98,04;4,2;Marrone
Clarks;Shacre Boot, Scarpe Chukka Unisex-Adulto;103,2;4,4;Marrone
Clarks;KIMMEI Twist Marrone;103,2;5;Marrone
Clarks;Linvale Sea, Stivaletti Donna;176,98;3,9;Marrone
Clarks;Juliet Palm, Mocassino Donna, AD Template Size;86,66;4,4;Marrone
Geox;D Flavie, Borsa Donna, Taglia Unica;178,85;3,7;Marrone
Clarks;Caroline Pearl, Mocassino Donna;79,98;5;Marrone
Timberland;Gannon, Scarpe da Trekking da Donna;60,46;4;Marrone
Clarks;Passo Roseville, Scarpa Mary Jane Donna;76,09;3,2;Marrone
Clarks;Emily 2 Kaylie, Stivaletto Donna;85,72;4,5;Marrone
Clarks;Desert London, Scarpe Stringate Derby Donna;68,36;4,2;Marrone
Geox;D Spherica Actif X2, Scarpe da Ginnastica Donna;40,9;4,4;Marrone
Clarks;Aceley Zip Hi, Scarpe da Ginnastica Basse Donna;48,84;4,4;Marrone
Clarks;ATL Trek Free WP, Scarpe da Ginnastica Donna;316,16;4,2;Marrone
Timberland;"Kinsley 6"" Impermeabile, Stivali da Escursionismo Donna";82,08;4,3;Marrone
Clarks;Perla di Caroline, Mocassino Donna, AD Template Size;61,35;4,4;Marrone
Clarks;Juliet Aster, Mocassino Donna;91,5;4,3;Marrone
Clarks;Fibbia Rebelle, Stivali alla Moda Donna;75,57;4,2;Marrone
Timberland;High Top Lace Up Sneaker, Scarpe da Ginnastica Donna;55,41;4;Marrone
Clarks;Ballerina Fawna Lily, effetto pelle di rettile, marrone, da donna;;4,4;Marrone
Clarks;Sara Clover, Ballerine Donna;;4,2;Marrone
Clarks;Bayla Light, Stivaletto Donna;;4,3;Marrone
Geox;D Palmaria J, Mocassino Donna, Cognac, 42 EU;98,28;4,3;Marrone
Lumberjack;Sandalo zeppa Donna Marrone Swh1406 002 b53;62,5;3,6;Marrone
Clarks;Lexi Bridge - Taupe, 41.5;414,85;5;Marrone
Clarks;Wallabee, Oxford da donna, Pat marrone crepuscolo, 37 EU;89,25;4,4;Marrone
Clarks;"Donna; Clarks; Siara65 Band; Donna Casual Clarks, Tan, 38 EU";63;4,2;Marrone
Clarks;Cora Giny, Mocassino Basso Donna;105,8;4,4;Marrone
Lumberjack;Sandali e Infradito per Le Donne, Color Marrone, Marca, Modelo Sandali E Infradito per Le Donne SW40006 006 Marrone;82,19;4;Marrone
Clarks;Sneakers Marrone 121833;54,8;3,1;Marrone
Timberland;Mont Chevalier Chelsea Chestnut;75;4,1;Marrone
Geox;J Theleven Girl WPF, Scarpe da Ginnastica Donna;81;4,3;Marrone
Geox;GeoxD Modesty C - Espadrilles Donna;40,16;4,4;Marrone
Clarks;Ambyr Light, Scarpe décolleté Donna;95,92;4,8;Marrone
Clarks;Bayla Rose - Stivali alla moda da donna;139,26;3,8;Marrone
