Marchio;Nome;Prezzo;Valutazione;Colore
Timberland;Brynlee Park Chelsea, Stivali Donna;78,78;3,7;Nero
Clarks;Glicklybrogue2, Oxford Donna;155,66;4,2;Nero
Clarks;Boucle Hamble, Stivale alla Moda Donna;155,66;4,8;Nero
Clarks;Clarks Stivaletto donna colore nero 163619 Nero 36 EU;177,51;3,4;Nero
Geox;D Larysse, Stivaletti Donna;47,67;4,8;Nero
Clarks;Ambyr Light, Scarpe décolleté Donna;80,09;4,2;Nero
Geox;D Spherica Ec1, Stivale alla Caviglia Donna;88,52;4,1;Nero
Geox;D Eleana I, Stivali Donna;104,08;4,1;Nero
Clarks;TORHILL Bee BLKPATENT;69,59;4,7;Nero
Timberland;Linden Woods 6 inch WR, Stivali Donna;167,19;5;Nero
Lumberjack;Stivale Donna SWK2007-001;105,29;3;Nero
Geox;D Felleny I, Stivale alla Caviglia Donna;159,9;4,7;Nero
Clarks;Fawna Soft, Ballerine Donna;159,9;4,6;Nero
Geox;D Palmaria J, Mocassino Donna;49,84;4,4;Nero
Clarks;Orinoco Spice, Stivali Donna;46,91;4;Nero
Clarks;TORHILL PENNY Nero 38;42,31;5;Nero
Geox;D Giulila F, Stivali Donna;126,02;4;Nero
Geox;D New Eraklia 80 A, Sandalo con Tacco Donna;100,47;4,4;Nero
Clarks;Ezoria Mae, Sandali Donna;66,84;4,5;Nero
Clarks;SPLEND Edge Black Leather;91,27;4,1;Nero
Lumberjack;Stivale Donna SWC2101-006;76,5;3,8;Nero
Clarks;Torhill Moss, Anfibi Donna;76,9;4,4;Nero
Geox;D Jaysen G, Sneaker Donna;110,37;4,1;Nero
Clarks;Deva Bell, Sandali con Cinturino alla Caviglia Donna;65,49;4,5;Nero
Timberland;6 in Premium Waterproof - Stivali Classici Unisex Bambini, Nero (Black Nubuck), 36 EU;211,12;4,2;Nero
Lumberjack;Stivaletto Donna SWK1913-001;51,55;4,4;Nero
Geox;D New Asheel, Stivali Alti al Ginocchio Donna;82,01;5;Nero
Timberland;6 in Premium Waterproof - Stivali Classici Unisex Bambini, Nero (Black Nubuck), 37 EU;90,08;5;Nero
Geox;D Sozy S A, Sandalo Scorrevole Donna;90,08;4,4;Nero
Geox;D New Asheel D, Stivali Donna;73,69;4,1;Nero
Clarks;Arla Wave, Sandali Donna;84,5;3,8;Nero
Geox;D Sorapis + Grip B, Sandalo Sportivo Donna, Nero, 37 EU;89,9;4;Nero
Clarks;Stivaletto Valvestino Lo Donna;89,9;5;Nero
Geox;D Dandra 40 B, Sandalo Donna;102,34;4,6;Nero
Timberland;Carnaby Cool Basic Chelsea, Stivali Donna;106,85;3,4;Nero
Geox;D Felicity NP ABX C, Stivali Donna;195,27;5;Nero
Clarks;Décolleté Ellanie Hope Donna;63,14;4,5;Nero
Geox;D Myria B, Scarpe da Ginnastica Donna;127,23;4,3;Nero
Clarks;TORHILL Rise Nero 36;139,9;4,2;Nero
Geox;D Spherica Ec1, Stivale alla Caviglia Donna;139,9;4,3;Nero
Geox;D Eleana, Stivale alla Caviglia Donna;95,76;5;Nero
Clarks;Malvarosa Passeggiata, Scarpe da Ginnastica Donna;70,41;4,3;Nero
Clarks;Hero Air Lace Blk su;50,87;4,3;Nero
Clarks;TORHILL Rise Nero;49,9;3,8;Nero
Clarks;Arla Glison, Sandali con Cinturino Posteriore Donna;94,44;5;Nero
Geox;Geox Women's D Gelsa a Wedge Sandal;88,55;3,9;Nero
Timberland;6 in Premium Waterproof - Stivali Classici Unisex Bambini, Nero (Black Nubuck), 39 EU;58,65;5;Nero
Clarks;Fawna Soft, Ballerine Donna;96,36;4,1;Nero
Clarks;Emily 2 Rubino, Scarpe décolleté Donna;48,39;3,8;Nero
Geox;D Iridea J, Stivali Donna;153,93;4;Nero
Lumberjack;Ramone, Stivali a metà Polpaccio Donna;65,49;4,3;Nero
Clarks;Stivaletti impermeabili da donna Neva Zip;185,64;3,8;Nero
Geox;D Brionia R I, Sandalo Piatto Donna;93,79;5;Nero
Clarks;Juliet Aster, Mocassino Donna;201;4,4;Nero
Clarks;Brezza Emily Mocassino Donna;252,41;4,3;Nero
Clarks;Teresa, Stivali alla Moda Donna;114,67;4,3;Nero
Clarks;Sharon Gracie Scuro-11m, Mocassino Donna, Pelle Nera con Filetto Marrone Scuro, 43 EU;58,04;4,1;Nero
Clarks;Zip Maye, Stivali a metà Polpaccio Donna;72,34;4,1;Nero
Geox;D Vilde, Stivaletti Donna;118,38;4,3;Nero
Lumberjack;Fabric, Scarpe da Ginnastica Donna;71,44;4,9;Nero
Geox;D Zene M, Borsa Donna, Taglia Unica;48,28;4,7;Nero
Clarks;Bayla Light, Stivaletto Donna;81,68;4,3;Nero
Clarks;Kepley Holly Décolleté Donna;23,08;3,5;Nero
Lumberjack;lumberjack;84;1;Nero
Geox;D Nebula 2.0 X B, Scarpe da Ginnastica Donna;102,96;4;Nero
Geox;D Annytah A, Balletto Piatto Donna;75,95;4,3;Nero
Geox;D Plummery A, Scarpe da Ginnastica Donna;43,8;4,5;Nero
Geox;D Ameris M, Borsa Donna, Taglia Unica;59,39;4,1;Nero
Clarks;Cora Haley, Mocassino Donna;63,07;4,1;Nero
Clarks;Baia di Charlten, Stivaletto Donna;65,28;3,8;Nero
Timberland;Sprint Trekker, Stivali da Escursionismo Uomo;60,57;4,7;Nero
Clarks;Aceley Step, Scarpe da Ginnastica Donna;67,17;5;Nero
Clarks;Orianna Cross, Sandali Donna;89,43;4;Nero
Clarks;Brezza Mare, Infradito Donna;98,28;5;Nero
Geox;D Ischia Corda B, Sandalo con Zeppa Donna;98,28;4,2;Nero
Geox;D Pheby 80 C, Pompa Donna;287,19;4,1;Nero
Clarks;Sandalo piatto Drift Petal da Donna;58,2;4,4;Nero
Geox;Sandali in Pelle D Spherica Ec6 Bianco -Altezza cu a 7.5cm-;98,28;4,1;Nero
Clarks;TORHILL Rise Nero 35.5;81,24;4,2;Nero
Geox;D Gardenia A, Sandali con Plateau Donna;50,89;5;Nero
Clarks;Brezza Passo II, Mocassino Donna;55,86;3,2;Nero
Geox;D Alinei, Borsa Donna, Taglia Unica;56,2;4,2;Nero
Geox;D Vilde F, Stivale alla Caviglia Donna;33,16;5;Nero
Geox;D Maygea, Borsa Donna, Taglia Unica;101,48;4;Nero
Geox;D Palmaria, Ballerine Donna;78,61;4,5;Nero
Clarks;Wallabeeevosh, Donna;81,89;1;Nero
Geox;D Xand 2s E, Sandalo Donna;81,89;3,9;Nero
Geox;D Faviola C, Classico Donna;76,01;4;Nero
Geox;D Celestye, Borsa Donna, Taglia Unica;98,36;3,9;Nero
Geox;D Leonory, Borsa Donna, Taglia Unica;98,36;3;Nero
Geox;D Solangy, Borsa Donna, Taglia Unica;90,08;4,4;Nero
Geox;D Frailea A, Borsa Donna, Taglia Unica;104,24;4,3;Nero
Clarks;Tuscan Strap, Sandali Donna;129,9;4,3;Nero
Clarks;Kataleyna Glow - Stivaletti da donna;129,9;2,6;Nero
Clarks;Un Rio Knit, Pantofole Donna;62,66;3,8;Nero
Timberland;15,2 Cm, Hochwertig, Wasserdicht, Stivali Donna;95,42;5;Nero
Geox;D Rawelle, Stivale alla Caviglia Donna;119,95;4;Nero
Clarks;Stivaletti Emily2 Kaylie Donna, Pelle nera, 43 EU;80,24;5;Nero
Geox;D Faloria B, Borsa Donna, Taglia Unica;53,58;4,1;Nero
Lumberjack;Scarpa Sportiva Allacciata in Tela da Donna Numero 37;168,61;4,4;Nero
Clarks;Giulietta Trim, Mocassino Donna;212,49;4,3;Nero
Geox;D Solangy A, Borsa Donna, Taglia Unica;212,49;4,1;Nero
Timberland;Malibu Waves 2-Band Slide, Ciabatte Donna;53,52;4,4;Nero
Clarks;Adella West, Scarpe da Ginnastica Donna;119,96;3,9;Nero
Clarks;Ashland Spin Q, Mocassino Donna;55;4,1;Nero
Geox;D Spherica Ecub-2 Sneaker;91,74;4,6;Nero
Geox;D Camalei E, Sandalo Piatto Donna;57,38;3,1;Nero
Clarks;Kataleyna sol, Scarpe décolleté Donna;63,85;4,2;Nero
Clarks;Passeggiata Arla, Sandali Bassi Donna;74,01;4,3;Nero
Clarks;Mocassini da donna Sarafyna Freva, Pelle nera interesse, 39 EU;98,09;1;Nero
Clarks;Glove Daisy, Scarpe da Ginnastica Basse Donna;59,5;2;Nero
Geox;D Spherica Ec1 A, Moccasin Donna;98,28;3,4;Nero
Geox;D Andrenne, Borsa Donna, Taglia Unica;123,43;3,9;Nero
Lumberjack;Sandali bassi da donna SWG9606 scarpe con zeppa comode casual nere;87,8;4,4;Nero
Geox;D Veriana A, Borsa Donna, Taglia Unica;114,18;3,7;Nero
Geox;D Cosmopolis + Grip, Moccasin Donna;119,9;4,1;Nero
Clarks;Kyndall Iris, Scarpe décolleté Donna;119,9;4,3;Nero
Clarks;Sashlyn Edge, Mocassino Donna;37,58;4,3;Nero
Geox;J Montrack Girl B Ab, Scarpe da Ginnastica Donna;45;4,6;Nero
Lumberjack;Line, Scarpe con Lacci Donna;53,48;4,3;Nero
Clarks;TEADALE Rhea Colore Pelle Nera, Scarpa da Donna Numero 39 EU;92,34;4;Nero
Clarks;Ambyr Joy, Scarpe décolleté Donna, Blu Marino, 39 EU;228,97;4,3;Nero
Clarks;Ambyr Joy, Scarpe décolleté Donna, Blu Marino, 41.5 EU;57,3;4;Nero
Clarks;Donna Rena Jazz Flat;66,3;4,2;Nero
Clarks;Mocassino da donna Un Loop Ave;203,8;4,3;Nero
Clarks;Scarpe con Tacon PAVONA Court;57,11;3,8;Nero
Lumberjack;Sport Coupon Scarpa Ginnastica Donna;59,41;4,5;Nero
Clarks;Sandali da donna Glide Hi Shore con zeppa, Denim Blu Tessile, 39 EU;85,71;3,8;Nero
Lumberjack;Sandali bassi da donna SWG9606 scarpe con zeppa comode casual nere;84,93;4;Nero
Geox;D Genziana 30, Sandal Donna;57,3;1;Nero
Clarks;Emily 2 Erin, Scarpe décolleté Donna;57,3;4,2;Nero
Geox;Geox Women D Spherica C Sneaker;63,22;4;Nero
Clarks;Pizzo Baille, Scarpa Mary Jane Donna;102,86;3;Nero
Clarks;Torhill Bee, Donna;114,67;4,2;Nero
Geox;D Aurelyi, Borsa Donna, Taglia Unica;114,67;4,2;Nero
Clarks;Orianna Glide Sandali In Pelle In Taglia 7, Interesse Nero, 41 EU;96,62;3,8;Nero
Clarks;Orianna Glide Sandali In Pelle;121,41;3,7;Nero
Clarks;Breeze MJ, Scarpa Mary Jane Donna;50,94;4,3;Nero
Geox;D Blandine, Borsa Donna, Taglia Unica;143,43;4,1;Nero
Lumberjack;Finster, Scarpe con Lacci Donna;42,78;4,4;Nero
Lumberjack;Slip On Donna SWL5111-001;46,3;5;Nero
Geox;D Fedra, Borsa Donna, Taglia Unica;292,27;3,9;Nero
Clarks;Ambyr 2 Grazia, Scarpe décolleté Donna;52,36;4,1;Nero
Lumberjack;Sandali Bassi da per Donna SWG9706 Scarpe con Zeppa Bassa Casual Nere;122,13;4,2;Nero
Geox;D Olympiy, Borsa Donna, Taglia Unica;49,87;4,1;Nero
Clarks;Ballerine da donna Breeze Roam;127,27;4,6;Nero
Lumberjack;STIVALE SUSANNA (40);82,51;3,9;Nero
Geox;D Demethri A, Borsa Donna, Taglia Unica;70,97;4,5;Nero
Clarks;Baille Lace, Scarpa Mary Jane Donna;110,36;4;Nero
Clarks;Clarks;58,24;5;Nero
Clarks;Kataleyna Step, Scarpe décolleté Donna;87,5;5;Nero
Clarks;Un Rio Mix, Scarpe da Ginnastica Donna;48,02;4,2;Nero
Timberland;Ray City, Cinturino alla Caviglia, Sandali Donna;55,07;5;Nero
Geox;D Corinne, Borsa Donna, Black, Taglia Unica;242,61;4;Nero
Clarks;Laina55 Court, Scarpe con Tacco Donna;75,23;3,9;Nero
Timberland;Sprint Trekker, Stivali da Escursionismo Donna, Nero, 41 EU;82,23;4,6;Nero
Clarks;Ezoria Mae, Sandali Donna;91,49;4;Nero
Lumberjack;Coupon, Scarpe con Lacci Donna;84,11;4,7;Nero
Geox;D New Asheel, Stivale alla Caviglia Donna;74,59;4,4;Nero
Clarks;Corsia di Tivoli, Stivali alla Moda Donna;75,08;4;Nero
Clarks;Ashland Lane Q, Mocassino da infilare Donna, US Frauen;41,45;4,4;Nero
Clarks;Griffin Mabel, Scarpe Stringate Donna;62,99;3,7;Nero
Geox;D Teoclea B, Stivaletti Donna;53,61;3;Nero
Clarks;Marie Mist, Scarpe Stringate Derby Donna;83,28;4,4;Nero
Clarks;TORHILL Moc Blk Patent;200,52;4;Nero
Clarks;Brinkley Emily Mocassino basso Donna;19;3,3;Nero
Clarks;Clarks Women's Fawna Soft Ballet Flat;61,94;3,6;Nero
Clarks;Teresa Skip Stivaletti Donna;81,69;4,4;Nero
Geox;J Casey Girl M, Scarpe Stringate Donna;60,2;4,4;Nero
Lumberjack;Sandali bassi da donna SWG9606 scarpe con zeppa comode casual nere;77,45;3,4;Nero
Clarks;Clarks Damen Brynn Glide Holzschuh;73,69;4,2;Nero
Timberland;Adley Shore;41,82;4;Nero
Geox;D Bigliana E, Stivaletti Donna;57,5;3,2;Nero
Clarks;Freva 85 Court - Scarpe col Tacco da Donna - Taglia 39.5 (EU) 6 (UK);75,66;3,6;Nero
Geox;D Adelash B, Sandalo Scorrevole Donna;55;4,2;Nero
Geox;D Camalei C, Sandalo Piatto Donna;213,59;4,2;Nero
Lumberjack;Jennie, Scarpe con Lacci Donna;83,5;4,1;Nero
Clarks;Julia Gem, Mocassino Donna;71,38;5;Nero
Lumberjack;Stowe, Stivaletti Bassi con Lacci Donna;87,33;5;Nero
Clarks;Layton Gem, Scarpe da Ginnastica Donna;65,49;4,1;Nero
Clarks;Drift Jaunt, Flip Flop Donna;44,39;5;Nero
Clarks;Ezera Ave, Scarpe da Ginnastica Donna;72,81;3,6;Nero
Clarks;Neva Zip WP, Scarpe Chukka Donna;39,9;4,4;Nero
Lumberjack;Doris, Scarpe con Lacci Donna;50,88;4,9;Nero
Clarks;Perla di Caroline, Mocassino Donna, AD Template Size;67,75;4,2;Nero
Lumberjack;Scarpa Sportiva Allacciata in Tela da Donna Numero 36;81,5;3,9;Nero
Geox;D ASHEELY E, Stivali Chelsea Donna;79,92;4,1;Nero
Lumberjack;Sandalo Donna Modello DALIDA SWI8706-002 U09 M0347 Colore BLACK/GUN METAL (BLACK/GUN METAL, Sistema Taglie Calzature EU, Adulto, Donna, Numero, Media, 40);81,89;4,2;Nero
Clarks;Bagliore Ambyr, Scarpe décolleté Donna;60,46;4;Nero
Clarks;Fibbia Rebelle, Stivali alla Moda Donna;69,76;4;Nero
Clarks;Aceley Zip Hi, Scarpe da Ginnastica Basse Donna;49,76;4,8;Nero
Clarks;Clarks Women's Hearth Rose Fashion Boot;69,36;4,3;Nero
Clarks;Clarks Women's Arla Wave Slide Sandal;67,88;4;Nero
Clarks;Ezoria Sling - Sandali Da donna, Black Interest,;54,9;3,6;Nero
Clarks;Ezoria Sling - Sandali Da donna, Black Interest,;61,98;3,8;Nero
Lumberjack;Sneakers Donna SWL5111-002;48,67;3,1;Nero
Clarks;Mocassini Elaina Harbor Donna;56,49;3,8;Nero
Clarks;Dashlite Strap, Scarpe da Ginnastica Donna;57,28;4,5;Nero
Timberland;Safari Dawn Backstrap, Sandali Donna;73,68;4,3;Nero
Clarks;Jaunt Way, Scarpe da Ginnastica Donna;36,07;3,7;Nero
Clarks;Hidi Holly, Scarpe da Ginnastica Basse Donna;19;4,2;Nero
Clarks;Rose Way, Sandal Donna;19;4,1;Nero
Clarks;Rose Way, Sandal Donna;55,04;4,2;Nero
Geox;D Pheby 50 A, Stivale alla Caviglia Donna;94,3;4;Nero
Lumberjack;Sandali bassi da donna SWG9606 scarpe con zeppa comode casual nere;204,1;4,5;Nero
Lumberjack;Sandali Bassi da Donna SWG9706 Scarpe con Zeppa Casual alla Moda Nere;57,3;3,8;Nero
Clarks;Rose Way, Sandal Donna;56,86;4,2;Nero
Geox;D Naileen C, Sandalo Scorrevole Donna;51,5;4,2;Nero
Timberland;Stivaletti Chelsea TB0A5ND7;61,1;4;Nero
Geox;W Spherica Long Park Giacca, Nero, 46 Donna;47,8;4,1;Nero
Clarks;Orianna Glide Sandali In Pelle In Taglia 8, Interesse Nero, 42 EU;51,35;4;Nero
Clarks;Clarks;62,99;4;Nero
Lumberjack;Kaia, Scarpe da Ginnastica Donna;185,98;4,4;Nero
Geox;J Sukie Girl A, Scarpe da Ginnastica Basse Donna;73,69;3,4;Nero
Clarks;Brezza di Bali, Scarpe da Ginnastica Donna;67,92;3,7;Nero
Clarks;Griffin Town, Sandali con Chiusura a T Donna, Nero (Black Leather Black Leather), 39 EU;49,03;4,4;Nero
Clarks;Stayso - Mocassini in pelle, colore: Nero;73,69;4,3;Nero
Clarks;Orinoco2 bay, Stivali alla Moda Donna;69,2;4;Nero
Clarks;Layton Rae, Scarpe da Ginnastica Donna;106,74;4,1;Nero
Geox;D Catria, Stivale alla Caviglia Donna;65,95;5;Nero
Lumberjack;Fridy, Scarpe con Lacci Donna;72,68;2,9;Nero
Geox;Geox Women's J Eclair Girl Ankle Boot;47,98;4;Nero
Clarks;Orinoco Hot, Stivali da Motociclista Donna;89,29;3,9;Nero
Clarks;Arla Wave, Stivaletti Bassi con Lacci Unisex-Adulto;98,28;4,2;Nero
Geox;D Adacter S B, Sandalo Piatto Donna;125,12;4,2;Nero
Geox;D Virnilisa 65 B, Pompa Donna;179,9;4,5;Nero
Geox;D Felicity NP ABX A, Stivale alla Caviglia Donna;179,9;4;Nero
Clarks;Mocassini da donna Suttyn Walk;71,02;4,3;Nero
Clarks;Juliet Shine, Mocassino Donna;73,69;4,8;Nero
Clarks;Ritzy75 Rae, Stivaletti Bassi con Lacci Unisex-Adulto;43,22;4,8;Nero
Clarks;Arla Jacory Donna;75,57;4,3;Nero
Timberland;Bambino Euro Sprint Stivali senza chiusura;78,93;4,5;Nero
Timberland;Safari Dawn Backstrap, Sandali Donna, Nero a Grana Piena, 37.5 EU Larga;78,37;4,2;Nero
Clarks;Bayla Nora, Scarpe décolleté Donna;66,75;2,9;Nero
Clarks;Arla Gracie, Sandali Bassi Donna;98,28;4,3;Nero
Geox;D Charyssa A, Ballet Flat Donna;98,28;4,2;Nero
Geox;Geox Women's D Cosmopolis + Grip Moccasin;70,04;3,9;Nero
Geox;D Kosmopolis + Grip, Moccasin Donna;42,62;3;Nero
Clarks;Layton Rae, Scarpe da Ginnastica Donna;53,24;3,8;Nero
Clarks;Dash Lite - Scarpe in;91,44;4;Nero
Clarks;Maye Shine, Stivali alla Moda Donna;181,51;4,3;Nero
Geox;J Eclair Girl, Stivale alla Caviglia Donna;59,73;4,2;Nero
Clarks;Cora Giny, Mocassino Basso Donna;83,5;3,6;Nero
Geox;D Vilde L, Stivaletti Donna;68,36;4;Nero
Geox;D Dandra D, Sandali Donna;61,99;4,4;Nero
Clarks;Daiss 30 Shine Scarpe in Pelle Verniciata Nera;64,7;4,1;Nero
Clarks;Caroline Dalia, Mocassino Donna;121,13;3,7;Nero
Geox;D Annytah C, Ballerine Donna;73,69;5;Nero
Lumberjack;Sandalo zeppa Donna Nero Swh1406 001 b01;56;4,2;Nero
Clarks;Tri Abby, Scarpe da Ginnastica Basse Donna;102,31;4,4;Nero
Clarks;Page Loafer, Mocassino Donna;48,64;4,2;Nero
Clarks;Teresa Passo, Scarpe décolleté Donna;98,28;4,6;Nero
Clarks;Un Damson Lane, Scarpe con Tacco Donna;64;4;Nero
Clarks;Sandali bassi da donna Arla Stroll;45,97;4,3;Nero
Clarks;Calla Facilità, Mocassino Basso Donna;80,09;3,9;Nero
Clarks;Orianna Twist - sandali da donna - taglia 41.5 (EU) 7.5 (UK);90,08;4,1;Nero
Clarks;Orianna Twist Sandali In Pelle Nero;52,5;4,2;Nero
Geox;D Adacter S A, Sandalo Piatto Donna;51,59;3,9;Nero
Lumberjack;Wendy, Sandali Punta Aperta Donna;168,7;4,4;Nero
Clarks;Rose Lane, Sandal Donna;81,5;4,1;Nero
Geox;D Rawelle B ABX A, Stivaletti Donna;87,5;4,4;Nero
Clarks;Loreleigh Ave, Ballerine Donna;102,96;4,3;Nero
Clarks;Triamelia Edge, Scarpe da Ginnastica Basse Donna;79,95;4,5;Nero
Clarks;Sift Lace, Scarpe da Ginnastica Basse Donna;69,33;4,4;Nero
Geox;D Adelash E, Sandalo Scorrevole Donna;49,1;4,7;Nero
Clarks;Sillian Bella, Stivali Chiusi Donna;200;4,3;Nero
Clarks;Nova Grove, Mocassino Donna;98,28;5;Nero
Clarks;Violet 55 Rae Scarpe in pelle;81,5;4,2;Nero
Clarks;Sillian 2.0 - Mocassini da donna;196,45;2;Nero
Timberland;Schuhe 6 inch Premium Junior;82,8;4;Nero
Geox;D Panarea B, Sandalo con Zeppa Donna;79,33;3,3;Nero
Clarks;Laina55 Sling, Scarpe con Cinturino alla Caviglia Donna;70;5;Nero
Clarks;Scarpe da donna Court Shoes;146,61;3,7;Nero
Clarks;Caroline Janna, Scarpe da Ginnastica Donna;175,32;3,6;Nero
Clarks;Fawna Soft, Ballerine Donna;111,51;4,3;Nero
Geox;D Spherica Ecub-2 E Trainers EU 37;80,5;3,7;Nero
Timberland;Nice Coast Cross Strap, Ciabatte Donna;81;3,9;Nero
Geox;Sneaker T02 A – Taglia: 36 (EU);75,07;4,2;Nero
Clarks;Neva Lo, Scarpe Chukka Donna;129,9;3,1;Nero
Timberland;hiking, winter boots Donna;129,9;4,1;Nero
Clarks;Stile Sashlyn, Mocassino Donna;82,08;5;Nero
Clarks;Ambyr Joy, Scarpe décolleté Donna, Blu Marino, 41 EU;73,4;4,3;Nero
Clarks;Gemma Ambyr, Scarpe décolleté Donna;87,85;4,2;Nero
Geox;D Lamidie + Grip ABX, Stivale alla Caviglia Donna;90,57;4;Nero
Clarks;Linvale Jerica, Scarpe décolleté Donna, Pelle Nera, 37 EU Larga;90,08;4,1;Nero
Clarks;Tri Carmen, Scarpe da Ginnastica Basse Donna;49,1;4,2;Nero
Geox;D Kaula B ABX A, Scarpe da Ginnastica Basse Donna;87,02;3,6;Nero
Clarks;Traccia di Adella, Scarpe con Lacci Donna;68,17;4,2;Nero
Clarks;Airabell Mid, Stivali Chelsea. Donna;46,03;4;Nero
Clarks;Brezza Passo II, Mocassino Donna;181,65;4,4;Nero
Clarks;Marie Mist, Scarpe Stringate Derby Donna;80,9;3,3;Nero
Geox;Spherica Ec4.1 Donna Sneaker Nero 41 EU;91,2;4,2;Nero
Clarks;Zip Airabell, Stivali Chelsea Donna;62,61;4,3;Nero
Clarks;Fiana Aubrie Mary Jane Flat Donna;42,75;3,6;Nero
Clarks;Sandalo piatto da donna Brynn Style;53,29;3,6;Nero
Clarks;Desert Boot.;80,84;4,5;Nero
Clarks;Baia di Mira, Sandali Bassi Donna;97,5;4,3;Nero
Clarks;SPLEND Edge Black Leather;59,9;4;Nero
Clarks;Sharon Dolly Halbschuhe, Mocassino Donna;60;3,5;Nero
Geox;D Abyes C, Sandali Donna;97,5;4,3;Nero
Timberland;KNBNK Braids SLDE 11699, Sandali Donna;88,77;4,6;Nero
Clarks;Adriel Viola, Scarpe décolleté Donna;81,93;3,8;Nero
Geox;D Spherica EC7 Mocassino in Pelle (Nero, Sistema Taglie Calzature EU, Adulto, Numero, Media, 41);84,64;4,2;Nero
Geox;D Calinda Mid H, Stivaletti Donna;83,99;4,8;Nero
Geox;D Myluse C, Scarpe Donna;200,15;4,1;Nero
Clarks;Andie Go, Stivaletto Donna;68,89;3;Nero
Clarks;KAYLIN60 Nero;53,16;4,3;Nero
Clarks;Un Cruise Lace, Scarpe Stringate Derby Donna;65,34;3;Nero
Lumberjack;Sneakers Donna SWL4811-001;69,99;4,2;Nero
Lumberjack;Sneaker da Donna Fadet Black Nero SWL4811;69,91;5;Nero
Clarks;Kataleyna Sol Décolleté Donna, Pelle nera, 41 EU;37,15;4,2;Nero
Clarks;Scarpa Lacci Donna Nero 26135292;100;4,7;Nero
Geox;D Myria A, Sneakers Donna;49,98;3,9;Nero
Clarks;Opal Glow, Stivali Alti al Ginocchio Donna;181,29;4,1;Nero
Clarks;Jenette Ease, Ballerine Donna, AD Template Size;61,87;4,6;Nero
Clarks;Glickly Derby2, Oxford Donna;171,99;4,3;Nero
Clarks;Carleigh Pearl, Mocassino Donna;196,01;4,3;Nero
Clarks;Breeze Coral, Infradito Donna;54,68;4,4;Nero
Geox;D Brionia R M, Sandalo Piatto Donna;57,3;4;Nero
Geox;D Xand 2.1s B, Sandali Donna;64,64;4;Nero
Clarks;Un Loop Top, Chelsea Boot Donna;41,93;4,4;Nero
Geox;D Brionia B, Sandali Donna;106,56;4;Nero
Clarks;Breeze Shore Ciabatte Donna;106,56;4,5;Nero
Clarks;26129952, Mocassino Donna;39,99;4;Nero
Clarks;Ashland Spin Q, Scarpe Basse Donna, Nero, 44 EU Stretta;207,5;4,4;Nero
Geox;D621BC 0QS22 Sneakers Donna;184,06;4,1;Nero
Geox;D Shahira Blu 37;84;4,7;Nero
Clarks;Sneaker da donna Wave Range AP Verde olive combi EU;87,5;4,4;Nero
Clarks;Tilmont Dalia, Ballerine Donna;54,27;4,2;Nero
Clarks;Sandali Nero 26142605;71,5;4,8;Nero
Clarks;LOKEN Step;57,83;4,7;Nero
Geox;Maddalusiac D55YMF Sandali da donna;50,08;4,4;Nero
Geox;Sandalo casual in pelle, con suola in gomma - D55YMF per: donna;45,52;4;Nero
Clarks;Brinkley Flora, Infradito Donna;48,51;4,1;Nero
Geox;D Pg1x B ABX B, Stivale alla Caviglia Donna;104,95;3,5;Nero
Clarks;Breeze Ave II, Scarpe da Ginnastica Donna;106,5;4,4;Nero
Clarks;Band Wagon - Scarpe col Tacco da Donna - Taglia 37.5 (EU) 4.5 (UK);65,57;4,6;Nero
Clarks;Freva 55 Court - Scarpe col Tacco da Donna;114,7;4,3;Nero
Clarks;Freva 85 Court - Scarpe col Tacco da Donna - Taglia 42 (EU) 8 (UK);54,46;4,3;Nero
Clarks;Freva 85 Court - Scarpe col Tacco da Donna - Taglia 37 (EU) 4 (UK);166,3;4,2;Nero
Clarks;Sneakers Donna Nero 151166;115,57;4;Nero
Clarks;DASHLITE Run;110,36;2,9;Nero
Timberland;Timberland Women's Linden Woods 6 Inch Faux Fur Lined Wr Fashion Boots;110,36;4;Nero
Clarks;Adriel Viola, Scarpe per Uniforme Donna, Pelle Nera, 37 EU Larga;26,37;3,7;Nero
Timberland;Hiking Performance HIKING WATER BOTTLE C BLACK OS UNISEX ADULTO, nero, 3000 ml, Casual;44,66;4,7;Nero
Timberland;Kenniston 6inch, Stivali Donna;76,01;4,2;Nero
Geox;D Vilde G, Stivale alla Caviglia Donna;59,8;4,6;Nero
Clarks;Giulietta Monte, Scarpe décolleté Donna, Pelle Nera Sintetico, 40 EU Larga;61,33;4,3;Nero
Geox;D Peython Low C D, Stivaletti Donna;86;4,2;Nero
Clarks;Mayhill Walk, Scarpe da Ginnastica Donna, Light Pink Lea, 39.5 EU;34,16;5;Nero
Lumberjack;Sandalo zeppa Donna Nero Swh1406 001 b01;57,22;4,7;Nero
Geox;Geox Girl's J Eclair Ankle Boot;83,83;4,1;Nero
Clarks;Clarks Women's Hana Sun Sandal;120,67;4;Nero
Geox;D Calinda Mid D, Stivali Donna, Medium;87,5;4,1;Nero
Clarks;Opale Meadow, Ballerine Donna;198,19;5;Nero
Clarks;Funny Dream - Scarpe Stringate Basse da Donna - Taglia 36 (EU) 3.5 (UK);195,27;4,3;Nero
Geox;D Zene S, Borsa Donna, Taglia Unica;195,29;4,4;Nero
Geox;J Sentiero Girl B Ab, Stivale alla Caviglia Donna;202,47;4,4;Nero
Clarks;Brinkley Flora, Infradito Donna;59,28;4,6;Nero
Clarks;Step Allenasea, Sandali con Cinturino alla Caviglia Donna;205,67;4;Nero
Clarks;Mocassino Jenette Ruby da donna, Pelle nera, 41 EU;54,02;3,6;Nero
Clarks;Westlynn Bella, Mocassino Donna;157,81;4,5;Nero
Clarks;Orianna Roam;97,5;5;Nero
Clarks;Nova Way, Scarpe da Ginnastica Donna;183,28;5;Nero
Clarks;Un Perri Way, Sandali con Cinturino alla Caviglia Donna;183,28;4,2;Nero
Clarks;Clarkspro Gem Mocassini Donna;184,28;4,4;Nero
Clarks;Ashland Bubble, Mocassino Donna;77,8;4,1;Nero
Clarks;Ashland Bubble, Mocassino Donna;104,95;3,9;Nero
Clarks;Ashland Bubble, Mocassino Unisex-Adulto;55,98;4,7;Nero
Clarks;26129952, Mocassino Slip-On Donna;85,81;4,2;Nero
Clarks;Kaylin 85TBAR2 Nero 35.5;87,5;3,6;Nero
Clarks;Sense Lily - Sandali da donna;208,1;4,2;Nero
Clarks;Kayleigh Peak, Mocassino Donna;45,82;5;Nero
Geox;Scarpe da Donna Stivale Pelle Nera D046RB-000TU-C9999;57,05;4,5;Nero
Clarks;Donna Teresa Step Pump;50,51;4,3;Nero
Clarks;Emily 2 Mabel, Scarpe décolleté Donna;50,4;3,2;Nero
Clarks;Smart Deva 20352895, Sandali col tacco donna;43,7;3,9;Nero
Clarks;Donna Drift Sun;146,14;4,7;Nero
Clarks;SEREN65 Strap Nero 37;67,17;4,5;Nero
Clarks;Paseo de Arla, Sandali Donna;54,89;2,7;Nero
Timberland;Sandali Donna Adley Shore - Numero;139,26;2,8;Nero
Clarks;warrenwarren?????? ? warrenwarren, Mocassino Slip-On Donna;139,26;4,4;Nero
Lumberjack;STIVALE SUSANNA (41);59,32;4,3;Nero
Lumberjack;Eugenia, Stivali ad Altezza Ginocchio Donna;56,93;4;Nero
Clarks;Donna nero;70,97;2,6;Nero
Clarks;Ballerine Meadow Rae Donna, Pelle nera, 38 EU;129,9;4,5;Nero
Clarks;6 paia di calzini bassi da donna con mezza imbottitura, scarpe da donna 4-10;129,9;4,1;Nero
Clarks;Bayla Joy, Scarpe décolleté Donna;59,93;2,7;Nero
Clarks;Maggio Calendula, Mocassino Slip-On Donna;51,02;3,6;Nero
Lumberjack;Drew Sneaker Donna;56,86;3,9;Nero
Clarks;Mocassino da Donna Jenette Grace;37,66;4,2;Nero
Geox;D Iridea B ABX B, Stivaletti Donna;70;4,2;Nero
Clarks;Aceley Step, Sneaker Donna;74,83;4,4;Nero
Clarks;Airabell Mid, Mocassino Donna;108,57;3,4;Nero
Geox;D Cosmopolis + Grip, Mocassino Donna;68,9;4,2;Nero
Timberland;Hiking Performance Hiking Sling Black OS Unisex Adulto, nero, CASUAL;155,66;4,2;Nero
Clarks;Wesley Shore, Stivaletti Bassi con Lacci Unisex-Adulto;201,49;4,2;Nero
Geox;D Milleiny B ABX B, Stivale alla Caviglia Donna;213,56;4,7;Nero
Clarks;Kayleigh Cove Mary Jane Flat Uomo;47,56;4;Nero
Clarks;Clarks Women's Ayla Low Ballet Flat;57,64;3,3;Nero
Clarks;Mira Ivy;80,5;4,4;Nero
Clarks;Glide Joy, Sandali a Ciabatta Donna;137,95;2,9;Nero
Clarks;Sara bay, Ballerine Donna;78,93;4;Nero
Clarks;Elizabelle Mae, Infradito Donna;222,1;4,3;Nero
Geox;D Myria G, Sneakers Donna;60,53;4,2;Nero
Clarks;Freckle Ice, Ballerine Donna;181;4,3;Nero
Geox;D Milleiny B ABX A, Stivale alla Caviglia Donna;195,27;4,3;Nero
Clarks;Carly Charm, Mocassino Donna;197,48;5;Nero
Clarks;Scarpe da donna Nyta 45 Jazz;184,28;4,4;Nero
Clarks;Donna Emily Rae Pump;60,72;4,3;Nero
Clarks;Adella West, Scarpe da Ginnastica Donna;92,11;3,9;Nero
Clarks;Marie Mist, Scarpe da Ginnastica Donna;60,47;4,1;Nero
Timberland;Belicia LNK Ank STRP - Sandali da Donna;60,5;4,1;Nero
Clarks;Juliet bay, Mocassino Donna;113,95;5;Nero
Clarks;Husky Jade Ballerina;51,75;4,3;Nero
Clarks;Neiley Pearl da donna;211,05;4,4;Nero
Geox;D ADVICE H VIT;74,96;3,7;Nero
Lumberjack;Fortune Kombat Boot da donna fondo carrarmato Black Nero SWH6301-001 (40);63,45;3,8;Nero
Clarks;Sneaker da donna Hollyhock Walk;67,57;3,8;Nero
Lumberjack;Stivali per Le Donne, Farbe Nero, Marke, Modell Stivali per Le Donne Luna Nero;77,15;3,9;Nero
Clarks;Scarpe Sportive Epic Film, Ebony Suede, 37 EU;42,6;5;Nero
Clarks;Margee Eve, Sandali con Tacco Donna;79,2;4,2;Nero
Clarks;Mocassini da donna Sarafyna Freva;77,29;4,2;Nero
Clarks;COURTLITE2 Run White Leather 40 EU White Leather 40;79,5;4,5;Nero
Lumberjack;RAM Sneakers Donna Sport Bassa con 2 Velcri Total Black Nero Nero;56,98;4,2;Nero
